type,video_id,comment_id,parent_id,author,text,published_at,like_count
top,p8KWdCzUHZM,UgyymiH0Ac63uBuv4Mp4AaABAg,,@annguyenvan828,cái này là quỷ ăn chứ người gì mà ăn kinh quá,2021-08-06T15:24:52Z,0
top,p8KWdCzUHZM,UgwLAStYC7Ddmh0JcFZ4AaABAg,,@ThaoLe-iy3oh,Thấy Quỳnh ăn ngon miệng thật,2021-08-05T09:33:40Z,0
top,p8KWdCzUHZM,Ugxe5-uQzQS7m06zloR4AaABAg,,@esmeraldasanchez9268,Wow what a meal 🥘,2021-08-05T03:52:16Z,0
top,p8KWdCzUHZM,Ugym-NLwCf5GD-840794AaABAg,,@VPBOYZ904,Japan has the freshest seafoods ever 😋😋😋,2021-08-04T15:29:44Z,1
top,p8KWdCzUHZM,UgyDhNDnXcPmGw0XRGh4AaABAg,,@thilyle6421,Cá dẹp lép là cá chai.thịt cá ngon lắm.kho ngêj ăng là giền luôn.,2021-08-04T13:16:01Z,0
top,p8KWdCzUHZM,UgyuXqcjZKdRQSvGLzB4AaABAg,,@thanhmaidoanthi2241,muốn ăn như v nhưng....ko có tiền 🥺,2021-08-03T14:19:38Z,0
top,p8KWdCzUHZM,Ugzshw12ubMVfpEXI7x4AaABAg,,@kurobakaito3009,chị nói tiếng nhật ghê thiệt,2021-08-03T13:14:27Z,0
top,p8KWdCzUHZM,UgxUTAj7z9LjO0uZF5p4AaABAg,,@hungluncanthovlog6856,Huyền basa tổng cộng số ký là 100.5kg,2021-08-02T15:14:25Z,0
top,p8KWdCzUHZM,UgzLwE5mT-UUEB4I5CR4AaABAg,,@Noibaivlogs,"Chu cha em nhìn mà đói qáu chị quỳnh ơi , anh chị em giúp tôi lên Top cái , lên 500 like là về mua nguyên 1 mâm thế này luôn",2021-08-01T16:29:20Z,0
top,p8KWdCzUHZM,UgzzyokKx4iPGp0njKd4AaABAg,,@Noibaivlogs,Chu cha em nhìn mà đói qáu chị Quỳnh ơi,2021-08-01T16:28:19Z,0
top,p8KWdCzUHZM,UgxB_l8v0aT8bCW7CyZ4AaABAg,,@giangthuc8789,Là 101kg,2021-08-01T13:49:27Z,0
top,p8KWdCzUHZM,Ugz7T6a_hL3HVNYt7Dd4AaABAg,,@ninhnhunganthi7580,ngon quá,2021-08-01T12:24:23Z,0
top,p8KWdCzUHZM,UgyVMokk3J7dAh3EYbd4AaABAg,,@ninhnhunganthi7580,quỳnh và bất 111kg,2021-08-01T11:45:58Z,0
top,p8KWdCzUHZM,UgxKFqkN0M769iOzyn54AaABAg,,@namnguyengiang110,cc bb,2021-08-01T10:38:02Z,0
top,p8KWdCzUHZM,UgyV2t7Nv4x-d_gO73d4AaABAg,,@saole4829,Vậy nếu ko ăn hết thì quỳnh định làm j cái mâm đó !,2021-08-01T05:17:51Z,2
top,p8KWdCzUHZM,Ugzmg6qnVWWS-4qgCo14AaABAg,,@응우티나우옌티응아,Quỳnh ăn như thế này chắc là đc công ty tài chợ hay sao. Chứ còn ai mà dám ăn nhiều đồ đắt tiền như vậy.,2021-07-31T06:51:16Z,0
top,p8KWdCzUHZM,UgzS7-bVsCP8tiLrY1d4AaABAg,,@tinhphan4570,Chị chỉ thích xem đi chợ và hai rau quả thôi xem ăn nhiều cũng chán,2021-07-31T01:18:00Z,0
top,p8KWdCzUHZM,UgzBmZ4QmP3dskAapBV4AaABAg,,@hoangbinnguyen8473,Đỉnh luôn,2021-07-30T03:58:46Z,0
top,p8KWdCzUHZM,UgxEV6UxJt98SVRC6JB4AaABAg,,@NguyenNguyen-cb6py,K biết ăn nhiều hải sản thế chị Q có bị ải chỉa k? Nửa đêm xem đói quá,2021-07-27T17:59:50Z,0
top,p8KWdCzUHZM,Ugw-eXprdkryGQoRsp14AaABAg,,@muitieu2750,Hello em o nhat em o Thành Phở Nao vay em Thay see food ham ghe,2021-07-26T13:10:50Z,0
top,p8KWdCzUHZM,UgwkhsY28rpJ9kO10uh4AaABAg,,@ThuyThanh-wy2ce,Chị ăn thêm đồ ăn cay đi chị,2021-07-25T12:29:32Z,0
top,p8KWdCzUHZM,UgxH5glKHwBxkM1OFnV4AaABAg,,@jjdh5964,Chi  nua  ba bet  cho  be  uong Thu di  chi,2021-07-25T12:04:16Z,0
top,p8KWdCzUHZM,UgzvBYP2Nsmb80NFPf94AaABAg,,@ThiNamPhuongNguyen,"co oi sao ca, nha,t ban ca co tat ko",2021-07-25T04:47:04Z,0
top,p8KWdCzUHZM,UgyaIPvNiBvqXWAYM354AaABAg,,@DungNguyen-dr8ru,tui thay ba an tui  them chay nuoc mieng,2021-07-23T15:32:32Z,0
top,p8KWdCzUHZM,UgxPjP_ESLoGHcUR_AN4AaABAg,,@brittanycrews9128,Niihau,2021-07-22T12:46:53Z,0
top,p8KWdCzUHZM,UgzHE-VtM3oUJdvvdxN4AaABAg,,@MoonlightLullabyBaby,"Bạn ăn nhai to quá, thật thô lỗ. Phù hợp với người nhật",2021-07-21T21:04:18Z,0
top,p8KWdCzUHZM,UgxHC5ve-KwMSLspxeV4AaABAg,,@huyenluu5676,an kieu chj QUYNH chac e phai nhin doi may thang ke tiep do sach tui,2021-07-21T12:16:09Z,0
top,p8KWdCzUHZM,UgxXGP00lREiCOsChLV4AaABAg,,@hangtrung4106,👍👏,2021-07-20T12:47:18Z,0
top,p8KWdCzUHZM,UgzRVyOOC6A0zvihaPt4AaABAg,,@bequynh900kvaotimbantinhvn9,"<a href=""https://www.youtube.com/watch?v=p8KWdCzUHZM&amp;t=2434"">40:34</a>  Crush ơihip cho tao 1 ít reallove đi 📳",2021-07-19T10:03:29Z,0
top,p8KWdCzUHZM,UgzexmsRwle6Wz9KQ694AaABAg,,@linhcu2367,"<a href=""https://www.youtube.com/watch?v=p8KWdCzUHZM&amp;t=2646"">44:06</a> dễ thương quá chị iu ơii 😍😆",2021-07-19T08:22:37Z,0
top,p8KWdCzUHZM,UgzdOxKxfp2csa5Hjwl4AaABAg,,@anglienthi3866,Ngon quá Quỳnh ơi...,2021-07-19T03:33:48Z,0
top,p8KWdCzUHZM,UgzdoahewwKY4D5u58t4AaABAg,,@Peach_editor,❤️❤️❤️❤️❤️,2021-07-18T10:52:18Z,0
top,p8KWdCzUHZM,Ugx-u0dGvjuxriAF9w14AaABAg,,@yenpham3837,chj ko ăn ốc vòi voi ạ,2021-07-18T04:37:30Z,0
top,p8KWdCzUHZM,UgwjLSP08WE2SOmmm1p4AaABAg,,@yenpham3837,"ngon quáaa,thèm quáaa",2021-07-18T04:35:45Z,0
top,p8KWdCzUHZM,Ugwf8ITAe7cFJTVt2I14AaABAg,,@netnguyen7114,người gì ăn nhiều quá bụng đâu mà chứa,2021-07-17T06:31:13Z,0
top,p8KWdCzUHZM,UgzRtdszn4Pg5Zkq3Dd4AaABAg,,@behaipham8151,Bé xa mấy tuổi rồi,2021-07-16T11:54:30Z,0
top,p8KWdCzUHZM,Ugx6FyDQLsCdRe1bRl14AaABAg,,@haitructruong8405,Xem pà Q bả xắn bào ngư . Thốn ghê . Quay qua bả chơi nước sôi con vòi voi . Pà ơi nó bủn rủng kakakak .🤪🤪,2021-07-15T15:46:23Z,0
top,p8KWdCzUHZM,UgxNnxE83XDMcxJB32J4AaABAg,,@thanhdannguyen4561,Toi yeu thich bai dang am thuc cua ban cuoc song o ben nhat ban,2021-07-15T15:43:37Z,0
top,p8KWdCzUHZM,UgwSzcng5tabyk8t2QF4AaABAg,,@SangdaoNguyenLe,Nhìn hải sản tươi sống ngon quáaaa.,2021-07-15T09:21:14Z,0
top,p8KWdCzUHZM,Ugzb-uAeHjdl6BXcc6d4AaABAg,,@nguyenthang2976,An khùng qua là con gái không ai dám thương kkkkkk,2021-07-15T07:15:05Z,0
top,p8KWdCzUHZM,UgxWiDN70g-ltQ5wRt54AaABAg,,@Danbaodoi,Bà quỳnh mập quá,2021-07-15T03:19:12Z,0
top,p8KWdCzUHZM,UgxqCXfKYSfpSaPKzOZ4AaABAg,,@HaLe-st8dv,Bàn hải sản ngon quá. Bé Sa đáng iu ghê,2021-07-14T16:43:00Z,0
top,p8KWdCzUHZM,UgyJzihCRXaTf87lcXt4AaABAg,,@ngocbui7975,nhìn cái mỏ của Sa mắc cười quá kkkk,2021-07-13T10:50:06Z,0
top,p8KWdCzUHZM,UgzrcCJKu0fXH5SST4B4AaABAg,,@23.nganthuo99,"Em thắc mắc là phần ruột mà mình bỏ đi á, chị giải quyết ntn để bảo vệ được môi trường ạ",2021-07-13T02:41:41Z,0
top,p8KWdCzUHZM,Ugx6gfuKGc-HJHcsNHd4AaABAg,,@kangtaetae1183,Chị Quỳnh làm cái gì cũng nhìn ngon hết trơn.Em sẽ luôn củng hộ kênh của chị.,2021-07-12T12:15:11Z,1
top,p8KWdCzUHZM,UgyWhmB96g45qFXTlqN4AaABAg,,@beovlog2094,Sa nói tiếng việt hay tiếng nhật vậy ạ,2021-07-10T07:38:25Z,0
top,p8KWdCzUHZM,UgwY5--nVqjLyZ6D00V4AaABAg,,@ngocbangle5712,hay quá,2021-07-09T02:24:43Z,0
top,p8KWdCzUHZM,UgxKHwLzFAjBd64BH4h4AaABAg,,@nyphan513,em nghe nói ăn rong nho nó tanh lắm chị cho em bí quyết ăn rong nho kô tanh với ạ,2021-07-08T13:36:32Z,1
reply,p8KWdCzUHZM,UgxKHwLzFAjBd64BH4h4AaABAg.9PXrnnd8OWe9PaeGKTMm4U,UgxKHwLzFAjBd64BH4h4AaABAg,@Bapthoyeu1619,"b ơi, ngâm nước rửa mấy phút cho nở xong đổ đi, lấy nước khác ngâm 1.2 phút rửa đi mấy lần là ko tanh tí nào luôn, lúc ăn cho mấy viên đá vào . rửa nhiều là ko tanh luôn đó",2021-07-10T00:55:12Z,0
reply,p8KWdCzUHZM,UgxKHwLzFAjBd64BH4h4AaABAg.9PXrnnd8OWe9PauiBShObA,UgxKHwLzFAjBd64BH4h4AaABAg,@nyphan513,@Bapthoyeu1619 cảm ơn bạn nhìu nhá :33,2021-07-10T03:18:57Z,0
top,p8KWdCzUHZM,UgwvK5azQRFUrTKYE3N4AaABAg,,@ainhitran4897,em bé của chị Quỳnh cute qué hà nhất là khi nhe bé nói tiếng Nhật :))) bé ko biết nói tiếng Việt à chị?^^,2021-07-08T08:43:03Z,0
top,p8KWdCzUHZM,UgwORWi_jowpFaHo7eB4AaABAg,,@thikimsavan4003,Đồ ăn ngon quá cô ơi,2021-07-08T08:18:40Z,0
top,p8KWdCzUHZM,UgzDiuskkK_O2h7TPTx4AaABAg,,@dannie_lee,Xem lại vẫn hayyy,2021-07-08T06:39:26Z,0
top,p8KWdCzUHZM,UgxqzeqDjnjJZcr71-x4AaABAg,,@thaonguyentran1412,Ăn kiểu này nhanh theo các cụ qua đi ..,2021-07-07T19:36:14Z,0
top,p8KWdCzUHZM,UgyOuhYD49vRSLq-wG14AaABAg,,@baotrang1635,Cho muối xong chị chà 2 con bào ngư với nhau là tự nó sạch.,2021-07-07T18:39:16Z,0
top,p8KWdCzUHZM,UgzdHlQidPRSYZK5VCF4AaABAg,,@tridung540,Chị ở việt nam sang nhật hay chị ở nhật rồi học tiếng việt ?,2021-07-07T18:04:27Z,0
top,p8KWdCzUHZM,UgyghxaGkShC8LGFvk94AaABAg,,@A_hahahha,cau bao nhieu,2021-07-07T13:02:45Z,0
top,p8KWdCzUHZM,UgwfJs9N6sEgkdGZkil4AaABAg,,@meetyoo6034,"<a href=""http://www.youtube.com/results?search_query=%2380000"">#80000</a>",2021-07-07T09:42:05Z,0
top,p8KWdCzUHZM,UgxYt8EOZynrn2BbiJZ4AaABAg,,@anhvu-co1rs,Hà nội đi chị,2021-07-05T16:05:39Z,1
top,p8KWdCzUHZM,Ugxoy1brVuOO8JWWeH54AaABAg,,@3tvofficial,"ngon quá chị ơi nhìn hải sản mà thèm ghê luôn , ăn mấy này mà uống bia nữa là xuất sắc luôn",2021-07-05T14:15:47Z,6
top,p8KWdCzUHZM,Ugzk461yP8Er1uu45jB4AaABAg,,@kieunaboo7724,Võ NGOCQ,2021-07-04T10:25:12Z,1
top,p8KWdCzUHZM,UgxMQ4ib3LNGcBBR0yN4AaABAg,,@khanhtv4807,Lần sau cj đeo gang tay vào nhá cj,2021-07-04T08:14:07Z,1
top,p8KWdCzUHZM,UgzWa1nAzPIrpRO3rDd4AaABAg,,@TrieuNguyen-dg4ue,Ghiền coi bạn này r ... chảy bc miếng luôn,2021-06-30T04:33:00Z,1
top,p8KWdCzUHZM,UgwhMO-fkIOYt1417TJ4AaABAg,,@channelletruong8231,Sao chị có thể ăn nhiều được hay thật.. mình nhìn ko đã cảm nhận thấy no từ mấy con so may rồi..chị ăn giỏi thật.suc ăn ko thua dan ông đâu,2021-06-28T06:30:11Z,0
top,p8KWdCzUHZM,UgyhrM10XrR84mEUsrp4AaABAg,,@atsnguyen2845,Nhỏ nói zamate : )),2021-06-26T22:12:18Z,1
top,p8KWdCzUHZM,UgwGCOnYK07efFMTM-p4AaABAg,,@minhthanhtranminhthanh8962,An di cu ken ngon gètc cại gi hu. U. Ngon pa,2021-06-25T07:38:28Z,0
top,p8KWdCzUHZM,UgzvFhF01Rlp-DZL98Z4AaABAg,,@vandang7902,Nể cái dạ dày của Q,2021-06-25T07:04:49Z,0
top,p8KWdCzUHZM,Ugylq4e_T4_kHqew9rR4AaABAg,,@DuongNguyen-pz2ox,Chj oj cho e bo phjm mat troi trong anh duoc ko chj e nan ni,2021-06-25T03:53:37Z,0
top,p8KWdCzUHZM,UgzEqebRHeW9tN_6OR54AaABAg,,@tienofficial9564,Ngon quá cô Quỳnh ơi,2021-06-24T12:01:07Z,0
top,p8KWdCzUHZM,UgzhTlvq5UmX76weZ514AaABAg,,@aimai4339,👍,2021-06-24T00:45:06Z,0
top,p8KWdCzUHZM,UgxLUuyiHaKGQNyJ-xp4AaABAg,,@zopmessivn5508,"<a href=""https://www.youtube.com/watch?v=p8KWdCzUHZM&amp;t=355"">5:55</a>",2021-06-23T18:14:17Z,1
top,p8KWdCzUHZM,UgxYmEd5TOsDmDhdBtl4AaABAg,,@zicmeow,😘,2021-06-23T17:04:04Z,0
top,p8KWdCzUHZM,UgyCE5be9Qy7y-O0O7x4AaABAg,,@sangcong3321,Ăn đã ghê á cj qùynh,2021-06-23T02:01:53Z,2
top,p8KWdCzUHZM,UgzV3FRWAz8Xal4gOrR4AaABAg,,@oidoioi5917,Thế này cả nhà ăn chắc cũng ko hết 😂 thịnh soạn quá chị ơi 😋,2021-06-22T13:09:53Z,0
reply,p8KWdCzUHZM,UgzV3FRWAz8Xal4gOrR4AaABAg.9Otc1cof4r19RbQyh8q_6u,UgzV3FRWAz8Xal4gOrR4AaABAg,@avatarlaemmiknho314,Bn có chơi tiktok ko,2021-08-29T01:12:21Z,0
reply,p8KWdCzUHZM,UgzV3FRWAz8Xal4gOrR4AaABAg.9Otc1cof4r19RbRhfPTPBT,UgzV3FRWAz8Xal4gOrR4AaABAg,@oidoioi5917,@avatarlaemmiknho314 . Ko .....,2021-08-29T01:18:45Z,0
reply,p8KWdCzUHZM,UgzV3FRWAz8Xal4gOrR4AaABAg.9Otc1cof4r19RbSAzd6swP,UgzV3FRWAz8Xal4gOrR4AaABAg,@avatarlaemmiknho314,@oidoioi5917 ukm,2021-08-29T01:22:54Z,0
reply,p8KWdCzUHZM,UgzV3FRWAz8Xal4gOrR4AaABAg.9Otc1cof4r19RbSE2ldk61,UgzV3FRWAz8Xal4gOrR4AaABAg,@avatarlaemmiknho314,@oidoioi5917 bn k mấy,2021-08-29T01:23:19Z,0
top,p8KWdCzUHZM,Ugz3IzEIUhXFOTd897J4AaABAg,,@DuyNguyen-rr3rt,lổ đíttttt nha mọi người :))),2021-06-22T04:11:40Z,0
top,p8KWdCzUHZM,UgxfscfUEobeE8wkU2J4AaABAg,,@NhungNguyen-ug3yz,Ngon quá,2021-06-21T13:26:40Z,0
top,p8KWdCzUHZM,UgxET6mA4J6_RVrqN4V4AaABAg,,@markkuno,Hải sản tuơi ghê :&lt;,2021-06-21T10:57:54Z,0
top,p8KWdCzUHZM,UgwjPU6Kfp-zQrfe1N14AaABAg,,@nirupamapatra6197,Rakhyasuni,2021-06-21T09:53:44Z,0
top,p8KWdCzUHZM,UgwM2eCH5OMBdaLERAl4AaABAg,,@Maymaytuantu,Bạn dỏi quá bạn ơi,2021-06-21T07:07:47Z,0
top,p8KWdCzUHZM,UgxAH5UVuL7tS827bsZ4AaABAg,,@hollywarbourn7777,Her voice annoys me,2021-06-20T22:31:40Z,0
top,p8KWdCzUHZM,Ugzhfbyc8201qymyuOt4AaABAg,,@christinelove8554,"Chau suong qua ong chong ko an do bien ma vo muon mua do bien Mac tien ma cu mua thoai mai. Co co qua Nhat choi 3 tuan di nhieu thanh pho, do an ben do rat Mac gan gap doi ben My tuy nhien rat tuoi va ngon. Nguoi Nhat rat de thuong va hieu khach. Hay huong thu nhung gi minh thich va co dip",2021-06-20T04:11:02Z,0
top,p8KWdCzUHZM,Ugx-dgyQVnZaOi-sRxt4AaABAg,,@YenLe-zd7ki,Con cá đâu dẹp là con cá chai. Cá chai kho khô ngon lắm đó em ơi,2021-06-18T06:11:58Z,0
top,p8KWdCzUHZM,UgymE-4B3QPdnWegE-Z4AaABAg,,@saigonnews805,Nhìn hấp dẫn quá. Thật tuyệt 😍😍😍,2021-06-16T06:10:16Z,0
top,p8KWdCzUHZM,Ugz-tGFBmkwyqfRSQKV4AaABAg,,@linhngoc6453,Wow Ngon qua,2021-06-16T04:56:50Z,0
top,p8KWdCzUHZM,UgxYdM_33OVyUfglTCp4AaABAg,,@dutup2,Nhìn thèm,2021-06-15T22:57:13Z,0
top,p8KWdCzUHZM,UgwdXYSm_rUODfQSoER4AaABAg,,@phuongthanhnguyen1151,99kg,2021-06-13T13:33:28Z,0
top,p8KWdCzUHZM,UgxuTsYiaROdZtOlYfJ4AaABAg,,@taiungdung9606,Chợ cá ở đâu vậy chị,2021-06-12T10:49:49Z,0
top,p8KWdCzUHZM,Ugy-DigdInLeNHKoDF14AaABAg,,@huybeo9812,Xin chào chị,2021-06-10T12:48:24Z,0
top,p8KWdCzUHZM,Ugyq69pMkoh-s5Gujy94AaABAg,,@HieuNguyen-rp6ls,Nhin mam hap dan wa e mon nao cung thay ngon,2021-06-10T06:07:34Z,0
top,p8KWdCzUHZM,Ugy6wfL5djsfErfrQSN4AaABAg,,@nguyenlanphuong9380,너무 맛있어 보여,2021-06-08T11:14:43Z,0
top,p8KWdCzUHZM,Ugz4aXiD8aqDPz4mThp4AaABAg,,@ggygh3372,Cj ăn thì nhìu nh hỏng có mập còn e hít kh khí thuiii cx mập:(((,2021-06-07T12:04:12Z,0
top,p8KWdCzUHZM,UgzvX476buxrWNMEJCF4AaABAg,,@linhdieu962,chị thường xuyên xem yt của em ra em là ng phụ nữ tuyệt vời. E ơi e làm yt thì e phải ăn nhiều đạm như thế e có sợ gút không?,2021-06-07T10:17:21Z,0
top,p8KWdCzUHZM,UgzqLgmJQAxcn_zx8r14AaABAg,,@stephanycorrea5348,hay quá,2021-06-07T09:26:34Z,0
top,p8KWdCzUHZM,UgzNXvQ5rA4VdWdJQNF4AaABAg,,@nhanthien3155,Cc,2021-06-06T14:59:43Z,0
top,p8KWdCzUHZM,UgwM7Kpfn94aK8vSuUB4AaABAg,,@雅芳-e8l,Mot minh an hêt sao,2021-06-06T14:46:34Z,0
top,p8KWdCzUHZM,UgxUa-mfD2YsbMqW4fZ4AaABAg,,@trieuquynhhan,还要做什么？,2021-06-06T06:16:18Z,0
top,p8KWdCzUHZM,UgwgJEz6UqHWujavmW94AaABAg,,@khanhi6257,chị ăn ngon quá,2021-06-05T15:58:48Z,0
top,p8KWdCzUHZM,UgyWu97DE72YkqeAVlt4AaABAg,,@Giaitrihay85,Món ăn ngon quá chị ơi!,2021-06-04T18:08:01Z,2
top,p8KWdCzUHZM,UgyyYi2rJa7ThZR9OrJ4AaABAg,,@HangNguyen-oy7rt,chép chép =))?,2021-06-03T17:04:54Z,0
top,p8KWdCzUHZM,UgyZyak8UZNqCBpH6-R4AaABAg,,@khongnguyen4250,L0,2021-06-03T10:36:55Z,0
top,p8KWdCzUHZM,UgyrVzU4pJgtBev_twN4AaABAg,,@ngocsuongtran4056,Ăn đừng ngốn quá xấu lắm,2021-06-01T06:31:39Z,0
top,p8KWdCzUHZM,UgzUbPQO8SgBAeuTpMl4AaABAg,,@Lequangdam92,Ngon quá chị ơi không biết cuộc đời này được ăn 1 lần như này không,2021-05-31T16:55:11Z,1
top,p8KWdCzUHZM,Ugw_PXY8fqVA6jbvK4h4AaABAg,,@TThao2301,Nhìn các loại hải sản của Nhật thật là tươi sống cj ạ,2021-05-29T11:06:21Z,2
top,p8KWdCzUHZM,Ugzdn-27FVWtPoPkPMJ4AaABAg,,@langlangdang8418,Em ăn cơm bật video chị lên coi ăn cơm ngon có động lực ăn và học được nhiều món mới 💕,2021-05-28T09:33:48Z,1
top,p8KWdCzUHZM,UgzH1K2mzrv-2wcPPZF4AaABAg,,@bautroibinhyen915,"Trời ơi, bà Quỳnh bả tưởng chỉ có mình bả là người đầu tiên ăn sản, nhìn bả ăn giống như chết thèm đâu từ trong bụng mẹ , con mực đó to nhưng ăn k ngon thịt nó xảm xì . Múc ống ăn mới ngon bà Quỳnh chắc bả nghĩ chỉ có mình bả có ăn, còn bạch tuột có ngon lành gì đâu bà Quỳnh ơi, óc đó vừa vừa mới ngon to qoá cứng, lại giai, còn cá hồi thịch nó béo ăn nhanh ngán cua bào ngư tôi thấy cũng bình thường, nhìn bả tôi thấy chán gì đâu, bà thèm bà ăn nhiều một chúc ,",2021-05-27T17:12:06Z,0
top,p8KWdCzUHZM,UgyfRufZ2uvKMXGmf0N4AaABAg,,@DieuNguyen-ru9th,Chợ hải sản ở đâu vậy chị ơi,2021-05-24T04:29:09Z,0
top,p8KWdCzUHZM,Ugx2fkTPhW6olodfSjR4AaABAg,,@HienNguyen-dt9nd,Nhìn đồ hải sản tươi ngon quá chị ơi☺,2021-05-22T14:43:41Z,9
reply,p8KWdCzUHZM,Ugx2fkTPhW6olodfSjR4AaABAg.9Ndy7VE7WGQ9dVbiQjlqu2,Ugx2fkTPhW6olodfSjR4AaABAg,@ckhoa2k,Nhưng mà đắt quá 😢😢,2022-07-15T12:28:25Z,0
top,p8KWdCzUHZM,Ugz_9AvNT8mY_h8i7zR4AaABAg,,@An베트남,😁,2021-05-21T16:24:57Z,0
top,p8KWdCzUHZM,Ugye9w6Yqrr7VnNgYYl4AaABAg,,@mychi5057,Chết gòi lộ hàng r bà quỳnh ơi,2021-05-20T14:17:12Z,0
top,p8KWdCzUHZM,Ugzds3SsU6whXpM5P-x4AaABAg,,@thanhthinh1088,Ăn hải sản hoài chắc đã ngán lắm rồi đây,2021-05-18T05:30:20Z,0
top,p8KWdCzUHZM,UgxcZUBjdzeRuOWbxx94AaABAg,,@ThanhLe-vz3rv,Nhìn  cô  này  ăn khg thể nghĩ  là  ăn nhiều  vậy   ăn  được  ghê,2021-05-17T20:32:39Z,0
top,p8KWdCzUHZM,UgzNGfUKihA0-P49NR14AaABAg,,@hoaingoc1443,Hàng Việt Nam chất lượng cao và ngon nữa chị,2021-05-16T03:30:22Z,1
top,p8KWdCzUHZM,UgxlnuZegns8-Jo-C014AaABAg,,@totue8369,Nhìn chị nấu mà em thấy ngon ghê 😋😋😋😋😋😅😅😅,2021-05-16T03:15:51Z,0
top,p8KWdCzUHZM,UgyF2FJ9Szuk1AdUMCN4AaABAg,,@sksaddam6439,Your good fresh 👌,2021-05-15T16:15:24Z,0
top,p8KWdCzUHZM,UgzY2edK_DSwYyZKe8h4AaABAg,,@hungphatnguyen506,chị ơi mua gì mà nhiều thế chị,2021-05-13T03:25:26Z,0
top,p8KWdCzUHZM,Ugy0YT1VgHXg8KlhdTZ4AaABAg,,@babylien9483,Tao lao,2021-05-11T09:37:22Z,0
top,p8KWdCzUHZM,UgyRwvhLxMnzAIuD9p14AaABAg,,@tramanhnguyen465,"<a href=""https://www.youtube.com/watch?v=p8KWdCzUHZM&amp;t=2001"">33:21</a> sa nói yamate hả ?",2021-05-09T16:56:10Z,0
top,p8KWdCzUHZM,UgzOc4gt62-a0ZenFap4AaABAg,,@DungLe-sw3om,Người ta bảo ăn như phá mả còn đây ăn ra tiền ra bạc,2021-05-08T00:47:27Z,0
top,p8KWdCzUHZM,UgwZsuL6gtQpOjygrh94AaABAg,,@sondang9509,Mỗi lần chị lên video e thích nhất cảnh chị đi chợ ak😀,2021-05-05T16:51:41Z,1
top,p8KWdCzUHZM,UgyXZQ7WzvjXbBowdcN4AaABAg,,@off296,Nhìn đồ ăn nó ngon nhưng nhìn cô ăn con hổg thấy ngon gì hết :&lt;&lt;,2021-05-05T10:12:59Z,0
top,p8KWdCzUHZM,Ugw0WtlSNXQEan2fGQ14AaABAg,,@JeanNouveaux,Khong thay thit gau?,2021-05-05T04:53:26Z,0
top,p8KWdCzUHZM,UgzIQnynSu_ouCm1F8p4AaABAg,,@Tuanhuy95,Idol em ơi em đang ăn kiêng mà  chị làm em muốn thèm chết luôn kkkkkkkk,2021-05-04T13:13:23Z,1
top,p8KWdCzUHZM,Ugw3xQT46tG2JxvUwsR4AaABAg,,@vuihoccungem5648,Hay quá bạn,2021-04-30T10:19:51Z,0
top,p8KWdCzUHZM,UgzKffqnbu4UUEW1AgR4AaABAg,,@giainhimiupham8534,Thằng bé chết thật hả,2021-04-30T05:27:41Z,0
top,p8KWdCzUHZM,Ugx_SKXyhlWmm-Kkto54AaABAg,,@LouisliamThoadao,"2 mẹ con dêc thương quá, rất vui được giao lưu kênh cùng chị.",2021-04-29T16:28:10Z,4
reply,p8KWdCzUHZM,Ugx_SKXyhlWmm-Kkto54AaABAg.9MivnbNMpilA2UlXaNsvyz,Ugx_SKXyhlWmm-Kkto54AaABAg,@ThoaThoa-lk7ls,Trê Tổ Quốc Đâm Đồng Bào Tẩy Chay MN,2024-04-21T10:11:13Z,0
top,p8KWdCzUHZM,UgwsLWlDLcXabJdKx2B4AaABAg,,@khanhhap3525,có thể cắt ngắn video đc ko cảm giác làm mất hứg ng xm,2021-04-29T01:17:39Z,0
top,p8KWdCzUHZM,UgwzgJmRLD-G4CCCpJl4AaABAg,,@duonganhphung352,Em làm video ăn nhiều vậy sao không thấy e mập,2021-04-28T08:38:36Z,0
top,p8KWdCzUHZM,UgwyQdG5qh8pAW1yAmp4AaABAg,,@dungluong9821,"ĐỂ MÌNH NÓI CHO CÁC BẠN BÊNH NGHE NÀY<br>Thứ nhất : Là một người nổi tiếng,làm video phải có nội dung chọn lọc.Về ẩm thực thì không phải thích ăn gì thì ăn,không cần biết là ở Nhật Bản ăn thứ đó là chuyện bình thường hay không.Xem video sẽ khiến người khác tò mò -&gt; tò mò là muốn thử -&gt; muốn thử là có cung -&gt; thêm động vật bị giết hại<br>Thứ 2 một video mà thực sự tốt và có ý nghĩa thì sẽ không có sự phẫn nộ và mang lại nhiều dislike đến thế.Chuyện đó không phải là tự nhiên<br>Thứ 3 các bác đừng bảo phật online nhé,nghe nó bào chữa bao biện cho hành động đấy lắm.Để giải thích này : các bác bảo bị giết rồi không người này thì người khác ăn đúng không ? Ok<br>Một người tiếp tục ăn là dẫn đến nhiều người,một người ăn là người bán tiêu thụ được sản phẩm =&gt; người ta lại tiếp tục sản xuất,giết để bán<br>Muốn người ta không bán nữa thì dừng việc tiêu thụ lại,tẩy chay ngay sản phẩm không để một sản phẩm nào được sử dụng nữa thì người bán mới thấy được là thị trường,sản phẩm này không còn phù hợp nữa<br>Thứ 4 Chị Quỳnh hứa sẽ sửa đổi và tiếp thu<br>   Ok đồng ý<br>Thứ 5 chị phải xóa video",2021-04-26T14:50:59Z,0
top,p8KWdCzUHZM,UgztY1yLcevTfCFW38t4AaABAg,,@baotranhuynh5882,Ăn chân gấu ghê quá má,2021-04-26T04:10:12Z,0
top,p8KWdCzUHZM,UgyrxwNRih17EpYP-ZB4AaABAg,,@jthoen61,That seafood looks amazing. Especially the crab. Now I want crab legs with melted butter. Yum.,2021-04-25T23:13:19Z,6
top,p8KWdCzUHZM,Ugyxl7IW1SJCpePPkoV4AaABAg,,@GrandmasterShadow666,I&#39;ll come eat with you!,2021-04-25T20:30:02Z,2
top,p8KWdCzUHZM,UgxKlKaFVS3SOYuzQfB4AaABAg,,@ป๊อปปี๊พัชรินทร์,มึงน่าจะแกะปูให้ลูกกินด้วยนะคะ,2021-04-24T10:36:12Z,0
top,p8KWdCzUHZM,Ugzlh5yS01RCiDFwdpB4AaABAg,,@Tatianarocha86,Essa nós podemos dizer que é boa de boca!,2021-04-24T03:19:40Z,0
top,p8KWdCzUHZM,UgzLWYwK65b-xWF8idt4AaABAg,,@brookeravenel9386,I love seefood,2021-04-23T03:11:13Z,0
top,p8KWdCzUHZM,UgyLbuixf3bJrTuG1SN4AaABAg,,@kunabubbles8035,Jesus is this Chinese!  Moving on!,2021-04-21T13:50:45Z,0
top,p8KWdCzUHZM,UgxtfEp2kxuGqgwRA3N4AaABAg,,@박연희-y3j,부자.......ㅠ 나도혼자 저렇게차려먹어보는게     꿈인데 ㅠ,2021-04-21T13:29:42Z,0
reply,p8KWdCzUHZM,UgxtfEp2kxuGqgwRA3N4AaABAg.9MP00Xewg699P5TNI69oGz,UgxtfEp2kxuGqgwRA3N4AaABAg,@GSANIME2,Hihi haha hoho,2021-06-27T12:55:35Z,0
top,p8KWdCzUHZM,UgxLPqW54kepVzVnwLh4AaABAg,,@nacao3433,"Bửa ni e thấy chị lên ký lắm luôn á c nha, ăn ít giữ cân nha, không béo ra ý c",2021-04-19T16:10:43Z,0
top,p8KWdCzUHZM,UgzY7KVkyeUM3UygUhp4AaABAg,,@amypham8680,Thay em Ăn cai mieng nhai ngon lam luon,2021-04-18T17:40:19Z,0
top,p8KWdCzUHZM,UgzZEKZljUHEt9FWGyB4AaABAg,,@lampham7335,C ăn có thể đừng chẹp chẹp dk k .,2021-04-18T15:25:57Z,0
top,p8KWdCzUHZM,Ugwcdhxldp7Zwax0WvF4AaABAg,,@XuyenNguyen-bk7ej,CON CU,2021-04-18T07:09:52Z,0
top,p8KWdCzUHZM,UgxPIw4YTnplrAeLZgl4AaABAg,,@bytumbithe6842,You are so took active.....,2021-04-16T01:15:54Z,0
top,p8KWdCzUHZM,Ugx45fsH5yyOm1e_iQ94AaABAg,,@tuananhdo930,Ngon mấy cũng không ngon được hơn món ăn Việt nam!,2021-04-15T23:19:25Z,0
top,p8KWdCzUHZM,UgySTgolSvLlcpvdGhp4AaABAg,,@elen-k9d,"Mazallah, yemeğe, misafirliğe falan gelse batarız😳",2021-04-15T21:41:52Z,1
top,p8KWdCzUHZM,UgzG3sV7p1ZMU5qxkYB4AaABAg,,@MijoNguyen,Congratulation You already have over 3 million Subscribe  ..Đồ Biển ở Nhật tươi ngon mà rẻ quá Trân ơi,2021-04-14T19:47:05Z,1
top,p8KWdCzUHZM,Ugw3H8d9B-9OdCGaXvB4AaABAg,,@PurpleMagicAiArt,What is the child eating? You eat fresh seafood he eats out of a packet!,2021-04-14T03:06:33Z,1
top,p8KWdCzUHZM,UgwZP9u9wgWafE1qTbF4AaABAg,,@NgocTuan89,Má đem hôm xem . Muốn bật dậy đi mua hết về ăn luôn. Xem mà nước miếng nuốt ực ực.,2021-04-12T17:54:42Z,0
top,p8KWdCzUHZM,UgwzevBXVOstze98aOp4AaABAg,,@vinhlu6313,Bà diên,2021-04-12T11:29:32Z,0
top,p8KWdCzUHZM,UgwgQ6GQpk7tTORWpe14AaABAg,,@chonhan4121,Trồng cây gần hàng rào vậy không sợ khi cây lớn sẽ rẽ sang nhà hàng xóm rụng lá rớt trái làm dơ sân người ta? please be considerate and think for others.,2021-04-11T23:52:42Z,0
top,p8KWdCzUHZM,Ugw7NZue46lQM62wHCl4AaABAg,,@quanghang8686,"Ăn nhiều quá! Tớ mua 1 con cua 2,9kg về ăn 1 cái chân với tí thịt nữa là no lắm rồi. Bà quỳnh bà ăn siêu thật.",2021-04-11T12:14:34Z,0
reply,p8KWdCzUHZM,Ugw7NZue46lQM62wHCl4AaABAg.9M-7TOfDnuT9M1DC6A_Kby,Ugw7NZue46lQM62wHCl4AaABAg,@macsau236,Bao tiền vậy. M chưa ăn bao giờ,2021-04-12T07:43:06Z,0
reply,p8KWdCzUHZM,Ugw7NZue46lQM62wHCl4AaABAg.9M-7TOfDnuT9M27UNTRL2k,Ugw7NZue46lQM62wHCl4AaABAg,@quanghang8686,"@macsau236 Mua loại vừa gộp1000k /kg, nó vẫn còn thở xong hấp luôn vẫn ngon như cua khỏe bạn ạ. Còn loại sống thường thì giao động 1350 đến 1550k tùy chỗ bạn ạ.",2021-04-12T16:12:25Z,1
reply,p8KWdCzUHZM,Ugw7NZue46lQM62wHCl4AaABAg.9M-7TOfDnuT9M4NMLPpc_l,Ugw7NZue46lQM62wHCl4AaABAg,@macsau236,@quanghang8686 thank bạn,2021-04-13T13:09:36Z,0
top,p8KWdCzUHZM,UgxKQawJ3d0GgUt5fLx4AaABAg,,@mamouneotomimi9563,J&#39;adore  manger  le crabe,2021-04-11T10:41:53Z,0
top,p8KWdCzUHZM,Ugy4MDDNY5CgLc5HwF54AaABAg,,@unname4295,"Xem các clip về ẩm thực của youtube , ta nói phải nói Q là tâm huyết nhất , từ thực phẩm, đồ gia dụng và hướng dẫn , ta  nói tâm huyết vô cùng. Chúc gia đình Q nhiều sức khoẻ bình an hạnh phúc thành công!",2021-04-11T05:36:20Z,49
reply,p8KWdCzUHZM,Ugy4MDDNY5CgLc5HwF54AaABAg.9LzPtfG7t0Z9RrZkf89Mx4,Ugy4MDDNY5CgLc5HwF54AaABAg,@melmel4577,Sũk,2021-09-04T07:36:55Z,1
reply,p8KWdCzUHZM,Ugy4MDDNY5CgLc5HwF54AaABAg.9LzPtfG7t0Z9U-4eZI41db,Ugy4MDDNY5CgLc5HwF54AaABAg,@diemhoaoffice638,"Bữa ăn 13tr thật quá phí, ở việtnam trong mùa dịch này nhiêu người đói khổ chỉ mong có mì tôm và gạo thôi mà kg có ăn.",2021-10-27T08:01:09Z,0
top,p8KWdCzUHZM,Ugxj0tp4rBZgNV2QNAh4AaABAg,,@강준희-u5s,ㅜ롸어어태뭧,2021-04-11T02:21:10Z,1
