type,video_id,comment_id,parent_id,author,text,published_at,like_count
top,p8KWdCzUHZM,UgxVjnBOwL15J5XJcjx4AaABAg,,@BinhNguyen-wf9eb,Số lần chị Huỳnh hừ hư. ----},2020-06-03T12:25:20Z,0
top,p8KWdCzUHZM,Ugx4ibA4KBP9VW86oSh4AaABAg,,@hieutrong4126,An roi,2020-06-03T12:19:47Z,0
top,p8KWdCzUHZM,UgwqXHcGyQ3lUEF0GgR4AaABAg,,@NgaLe-op1di,Hai san tuoi ngon wa,2020-06-03T12:12:38Z,0
top,p8KWdCzUHZM,UgwfYQj4vfPpN6gDUFV4AaABAg,,@LienNguyen-tk9nz,Quỳnh ơi...đang thèm hải sản mà Quỳnh ăn vậy ai chịu nổi...ực ực....,2020-06-03T11:43:38Z,0
top,p8KWdCzUHZM,UgwFbR8Rp4-rAAAlKth4AaABAg,,@laiphuongtuyen4544,Anh bán cá rất cảm ơn chị,2020-06-03T11:37:55Z,0
top,p8KWdCzUHZM,UgyyaRRzDLzyWDebP7x4AaABAg,,@tranvantan65,👏👏👏👏👏👏👏,2020-06-03T11:21:42Z,0
top,p8KWdCzUHZM,UgymT4zp-5sDr81Xcpd4AaABAg,,@huynhtho2373,Dì Quỳnh ơi dì Quỳnh làm món bánh tokbokki bằng bánh tráng đi ạ❤️,2020-06-03T10:54:36Z,0
top,p8KWdCzUHZM,UgwzESgyvPjx6jbYGuV4AaABAg,,@anthuy1124,"Uoc gì dc ăn như chi ấy,chưa bao giờ dc ăn mấy con đó luon vì kg có đều kiện chán thật",2020-06-03T10:52:48Z,0
top,p8KWdCzUHZM,Ugz1K60uOLcFuSG9fB54AaABAg,,@NgocAnh-kq7ry,Ủa sao cái mỏ sa tều lên thế,2020-06-03T10:23:45Z,0
top,p8KWdCzUHZM,Ugw5FqSj1oZWMB4Pcrd4AaABAg,,@vohung1017,"Nhiều hải sản quá, đã quá c ơi, làm e thèm lun😋😋😋",2020-06-03T09:18:35Z,1
top,p8KWdCzUHZM,UgyCWSDoSXVsNrA2E-Z4AaABAg,,@nguyenduchung2355,EM CHẾ BIẾN GIỎI NGON HẤP DẪN! CHỖ NÀY 6-7 NGƯỜI MỚI THƯỞNG THỨC HẾT!,2020-06-03T09:05:44Z,0
top,p8KWdCzUHZM,UgyEYjCbvfHyf6Zp6mN4AaABAg,,@mrafli4023,Idk. Why is this on my recommendation👈👉,2020-06-03T08:16:07Z,3
top,p8KWdCzUHZM,UgxhS5SY9KBSc_V2Wo94AaABAg,,@kDAOTHIHAO,Chợ hải sản này ở đâu vậy c,2020-06-03T08:11:27Z,0
top,p8KWdCzUHZM,UgzShWHNySytPbbonRR4AaABAg,,@PhongNguyen-zk9yj,Chị ơi em nghe nói ở Nhật Bản có rất nhiều ma đúng không ạ ?,2020-06-03T07:57:04Z,0
top,p8KWdCzUHZM,UgwjCaWopwMdF1WOexh4AaABAg,,@thuhoang4263,Nói như con chap y,2020-06-03T07:56:00Z,0
top,p8KWdCzUHZM,UgyUmZflY5jpEbNLAG14AaABAg,,@ngulehoang8651,nhieu hai san thom ngon qua,2020-06-03T07:44:46Z,0
top,p8KWdCzUHZM,UgzPkXI99iYELWvnwyV4AaABAg,,@luchoangvan6151,nhin chi cang ngay cang ngon,2020-06-03T07:18:30Z,0
top,p8KWdCzUHZM,UgzDf_YeTt-E-TCPYgN4AaABAg,,@hoaanhduhoa9283,Ko có em nào ăn cùng mắt ngon,2020-06-03T07:11:31Z,0
top,p8KWdCzUHZM,Ugz_44H4WD4O0Ite5814AaABAg,,@hoaanhduhoa9283,Ngon,2020-06-03T07:10:23Z,0
top,p8KWdCzUHZM,Ugy6vGX8Tk-qvC-_SXF4AaABAg,,@minhtriet7614,101,2020-06-03T06:48:09Z,0
top,p8KWdCzUHZM,UgzYi5F_LtQz1hxJsHN4AaABAg,,@vungpham1566,c cho e.hoi la thuoc giam can ABC.cua nhat ban tot k c.thank c.,2020-06-03T06:46:50Z,0
top,p8KWdCzUHZM,UgxCvd8_yLlt_NtbEPJ4AaABAg,,@thamsocius7111,lần sau ăn miếng nhỏ nhỏ thôi c ạ ăn miếng to quá nước nhể nhãi nhìn ghê quá. Với lại bớt ừ ư đi . Nghe c rên e sợ quá 😞,2020-06-03T06:45:28Z,0
reply,p8KWdCzUHZM,UgxCvd8_yLlt_NtbEPJ4AaABAg.99R9n-IHMcw99U9w5DWHRu,UgxCvd8_yLlt_NtbEPJ4AaABAg,@hiyumikaina,"Thương hiệu triệu view của C Quỳnh đó bạn, ăn vậy mới khiến ng xem thèm được á",2020-06-04T10:44:25Z,0
top,p8KWdCzUHZM,Ugzw2zumJRXObH4lkcR4AaABAg,,@nguyenquyen2148,Chị ăn như bà trâu ý. Ghiền thật chứ,2020-06-03T06:37:49Z,0
top,p8KWdCzUHZM,Ugzjk8EvnVF8M9narid4AaABAg,,@thamsocius7111,Công nhận số mấy ng này sướng thật đã được ăn ngon lại có tiền. Chẳng mất mát gì còn bổ béo nữa ko chia cho mình xíu nhìn mà chỉ ước,2020-06-03T06:26:24Z,0
top,p8KWdCzUHZM,UgxGkxEBxLy6M51XOfN4AaABAg,,@thimythaotran3041,Ngon qua c,2020-06-03T06:07:25Z,0
top,p8KWdCzUHZM,UgzyStCEsu5QrOyO21R4AaABAg,,@cutucu1696,Lớp em có bạn kia 60 ki-lô-gam,2020-06-03T05:32:48Z,0
top,p8KWdCzUHZM,Ugyzn16yGdqcCxMYrcN4AaABAg,,@thiutmuoinguyen440,Thật sự coi đồ ăn rất ngon.. nhưng sao thấy mọi người ăn với chị này ăn không có nhai..nhai hai ba cái nuốt.. mình mà nuốt hây như vậy chắc ăn được nhiều.. chị này nấu ăn nhìn ngon hấp dẫn nhưng nhìn cái mỏ thì 🤪,2020-06-03T05:30:09Z,0
top,p8KWdCzUHZM,Ugzrc4n0BzAO9N9tWgF4AaABAg,,@nhacuamia5127,Có ai đang bầu mà xem kênh chị Quỳnh như em ko? Thèm sashimi quá chị ơi. Hồi xưa bầu Sa c có ăn hải sản ko chị?,2020-06-03T05:18:21Z,0
top,p8KWdCzUHZM,UgyUj99Jgb8uEnJ3FPN4AaABAg,,@PhucNguyen-dq7ef,Ăn  z chừng  nào  mới  chết,2020-06-03T05:12:58Z,0
top,p8KWdCzUHZM,UgwzG8OR1q6iJnHY1X54AaABAg,,@hoangthimaihoang4347,Lam 24 gio di,2020-06-03T05:12:08Z,0
top,p8KWdCzUHZM,UgwGJFy9uDBpai7Qn6F4AaABAg,,@auxanhofficial5940,Ci Quỳnh làm clip chất lượng. Đầu tư. Chứ kh như các ytb khác...  Kh nói riêng ai. Nhưng ci Quỳnh chịu chơi quá. Được Xuất Sắc ạ,2020-06-03T05:11:19Z,0
top,p8KWdCzUHZM,UgyoaM1Ca--v73dqW6h4AaABAg,,@hoangthimaihoang4347,Chị ơi Nhìn coi sờ điêp như là cai......*<b>*</b>,2020-06-03T05:07:35Z,0
top,p8KWdCzUHZM,UgxOoAJcuzARrgB2K814AaABAg,,@nhanho6107,Hai San bên Nhật nhìn ngon thiệt,2020-06-03T04:50:26Z,0
top,p8KWdCzUHZM,UgxG34t2k5xA-vL8UW54AaABAg,,@bffhf2075,Tui thấy bả ăn mà tui chảy nước miến,2020-06-03T04:38:47Z,0
top,p8KWdCzUHZM,UgzROTMCHH5xwU2-FXN4AaABAg,,@duythanh6855,Trên bàn của cj bằng 15 mâm đám giỗ chổ em,2020-06-03T04:36:46Z,0
top,p8KWdCzUHZM,UgxLpfKKspC0V48lQzB4AaABAg,,@votranh87,"Cị quá giỏi <br><a href=""https://www.youtube.com/watch?v=J5d0plR81uM"">https://youtu.be/J5d0plR81uM</a>",2020-06-03T04:25:27Z,0
top,p8KWdCzUHZM,UgxzOx8uYJ9zkHjTos94AaABAg,,@t2kgaming77,Ăn vậy rồi khi nào chết 🙄,2020-06-03T03:55:47Z,0
top,p8KWdCzUHZM,UgxT-_b_hHT4CoQ6Iqt4AaABAg,,@anhoang6111,🦀 còn sống k chị mà e thấy nó còn cử động kìa . nó cắng chắt đâu lắm,2020-06-03T02:08:38Z,0
top,p8KWdCzUHZM,Ugy5niDHSMFJ5ekETNh4AaABAg,,@thinhlove94,Thấy bả ăn mk sợ đàn bà luôn khỏi giám lấy vk,2020-06-02T20:09:22Z,0
top,p8KWdCzUHZM,UgzSIh9gkpyHflmwl2N4AaABAg,,@gamly2315,Đang đói bụng gặp bả ăn chịu ko nổi..ko biết bả ăn trong bao lâu mà ăn vậy là ăn mạnh lắm luôn..tui thấy con sò mai với con ốc là tui no rồi kaka,2020-06-02T18:11:14Z,0
top,p8KWdCzUHZM,UgyrdbMz8LiRlSC8SNR4AaABAg,,@YBB2010,Điểm danh những người coi video này về đêm... =)),2020-06-02T17:47:13Z,1
top,p8KWdCzUHZM,Ugw4cHXfnKplW8Wdlk94AaABAg,,@nguyetngaha684,Ta ăn từ từ người j đâu ăn giống ... Qua troi,2020-06-02T15:10:22Z,0
top,p8KWdCzUHZM,UgwjNu8AzYboSwVP4Kl4AaABAg,,@Khobeideidiem,Cô tính nhẩm đúng lẹ lun á . Con đi check bằng máy tính đúng chuẩn ghê,2020-06-02T14:55:56Z,0
top,p8KWdCzUHZM,Ugy3gjpxNs4tOAZm0Ct4AaABAg,,@phuongtranmai2574,"<a href=""https://www.youtube.com/watch?v=p8KWdCzUHZM&amp;t=1021"">17:01</a> nó trắng như ngọc trinh <br>:&gt;&gt;",2020-06-02T14:48:32Z,4
top,p8KWdCzUHZM,UgysRAdCpDcqPKipwHZ4AaABAg,,@truong2089,Đang tối mà xem cái này làm em thèm 🤤🤤😋,2020-06-02T14:47:49Z,0
top,p8KWdCzUHZM,UgwtjTSMasGOT5lwe294AaABAg,,@tuyenngoc8978,&quot;Miễng là chúng mày đau khổ&quot; - Quỳnh said <br>:&#39;((((,2020-06-02T14:35:56Z,0
top,p8KWdCzUHZM,Ugwt7T7khbJxTE7hHZt4AaABAg,,@laosoigaming4006,Một mâm thịnh soạn quá,2020-06-02T14:19:58Z,0
top,p8KWdCzUHZM,Ugy37PtTcugbH25kmPJ4AaABAg,,@hoangthaotruong4789,Phải chi e đươcj ở gần nhà chị để ăn phụ chị.,2020-06-02T13:59:46Z,0
top,p8KWdCzUHZM,UgxIncgfHL6eGcOBogJ4AaABAg,,@loanluong1051,Chị thật là gioi và sướng thật 💋💋💋😄😄😄😄👍👍👍👍👍👍👍💯💯💯💯💓💓💓💓💓💓,2020-06-02T13:22:19Z,0
top,p8KWdCzUHZM,UgziYXqtY-g0z-L2JiB4AaABAg,,@anhhoang2233,Trời ơi xem mà thấy đói quá nè 🤣,2020-06-02T13:08:26Z,0
top,p8KWdCzUHZM,UgwAih-2nYZNBUC4mSN4AaABAg,,@tranduyjapan2565,"cho mình hỏi muối ớt xanh, ở nhật siêu thị nào bán vậy bạn???",2020-06-02T12:33:26Z,0
top,p8KWdCzUHZM,UgzxHOwC5bS2qiUfFXV4AaABAg,,@thangminh8930,Chị này ba ăn du thật xem nai giờ thấy bả an quá trời lun,2020-06-02T12:23:06Z,1
top,p8KWdCzUHZM,UgwivDnixktcNMTktkd4AaABAg,,@anhduongvo7563,Ghiền mỗi chị Quỳnh,2020-06-02T12:05:24Z,0
top,p8KWdCzUHZM,UgwAqL6Q79oQLPlRA1p4AaABAg,,@ngavo7724,V that anh sa,2020-06-02T12:05:16Z,0
top,p8KWdCzUHZM,UgxmxriS-e5rsjxatI14AaABAg,,@DuDu-cl5gs,Em cũng ăn cái sốt muối ớt xanh á ngon thật sự 😂 Em mới ăn sốt đó với xúc xích Đức luôn sắp hết chai rồi định mua thêm chai thứ 4. Em có ăn cả loại màu đỏ nữa cũng ngon lắm nhưng cay hơn.,2020-06-02T11:44:27Z,0
top,p8KWdCzUHZM,UgzHLmGdf4KBBdb1Pg14AaABAg,,@huyapchai8535,"<a href=""https://www.youtube.com/watch?v=p8KWdCzUHZM&amp;t=1080"">18:00</a> :))",2020-06-02T11:14:12Z,1
top,p8KWdCzUHZM,Ugyh7rdTLqxMz1EXDqF4AaABAg,,@mientaytvbinh,Ăn cho cố làm YouTube nó không trả tiền rồi la làng,2020-06-02T10:58:42Z,0
top,p8KWdCzUHZM,UgyBToQWiSpvxJRmVYV4AaABAg,,@thanhcong9346,Ngon ghe,2020-06-02T10:53:23Z,0
top,p8KWdCzUHZM,UgyxOnJk1JLOBBwSDmd4AaABAg,,@hale4595,Nghĩ cũng hay nhỉ. Đa số vào đây đang ký kênh bà sẽ có tiền tỷ để bà mua hải sản cả mâm ăn. Trong khi các thánh cứ nuốt nước miếng bảo răng biết khi nào mới được ăn cua hoàng đế vậy thì cái thời gian xem video này nên kiếm tiền qua onl đi. Vidu buôn bán onl chẳng hạn. Đá nghèo kiết xác cả ko lo kiếm tiền còn cứ lo đi làm giàu cho người khác. Tui ko đăng ký nhé thấy họ chia sẻ vào xem lần đầu tiên. Chị này cái miệng ăn cứ trề trề nhìn kinh vãi.,2020-06-02T10:50:12Z,0
top,p8KWdCzUHZM,UgwxTxOBFDA7op0tazp4AaABAg,,@ainguyensi4940,kênh này sub còn nhiều hơn cả mấy kênh ca sỹ nổi tiếng,2020-06-02T10:01:37Z,0
top,p8KWdCzUHZM,UgzPUTTHF48JJIJBIGR4AaABAg,,@billynguyengialinh3091,Đoạn đầu Sa có cái xe đẩy chất thật 😂😂😂😂,2020-06-02T09:54:30Z,1
top,p8KWdCzUHZM,UgzV7vPTdTaMhweXBBV4AaABAg,,@quynhhoa5022,"<a href=""https://www.youtube.com/watch?v=p8KWdCzUHZM&amp;t=3"">0:03</a> bé sa kìa",2020-06-02T09:47:49Z,0
top,p8KWdCzUHZM,UgwcEEfAY_ZFHY-qkv54AaABAg,,@tuanha8179,Mặc dù em bị dị ứng hải sản nhưng xem mà em kh thể k nuốt nc miếng🤤🤤,2020-06-02T09:47:48Z,0
top,p8KWdCzUHZM,UgzhwdZ9ojzQSCPTJnp4AaABAg,,@mylinh2007,Đê muôi chi da,2020-06-02T08:47:47Z,0
top,p8KWdCzUHZM,UgwmyBP8e7NKX00pv794AaABAg,,@haianhaofficial1205,hải sản nhìn tươi ngon quá. mình ủng hộ bạn đầy đủ. rảnh qua nhà mình chơi nhe!,2020-06-02T08:01:17Z,0
top,p8KWdCzUHZM,UgwRn17HPxTeY_BNc1J4AaABAg,,@nhuycattuong3883,"Ngon quá cô, con rất thích xem video của cô nên 2 chị em con ăn gì cũng quay video hihi",2020-06-02T06:52:59Z,1
top,p8KWdCzUHZM,Ugwxlq_onlB1FpS_2Nt4AaABAg,,@muoiaovan3972,Chi an khoe that,2020-06-02T06:47:38Z,0
top,p8KWdCzUHZM,Ugx6pzUv0HQhPMnQMR54AaABAg,,@thilannguyen1436,Chúc kênh Quỳnh làm ngày càng thành công hơn nữa.gia đình Quỳnh luôn luôn happy và khỏe mạnh...I Love you,2020-06-02T06:45:24Z,0
top,p8KWdCzUHZM,Ugzn0a5ANuzlSfl-h1V4AaABAg,,@eltonsilva8431,"Chị ăn ngon sang quá. Em ước gì được ăn một bữa như vậy, mặt dù em là người có điều kiện nhưng ăn 1 lần 1 mấy triệu em không giám ăn đâu, tiếc lắm biết là ngon",2020-06-02T06:41:26Z,0
top,p8KWdCzUHZM,Ugw6C3yCioQzNX7D8ql4AaABAg,,@DuyenNguyen-zm6tr,Quỳnh  quay  tiền  nhật bản  Cho  mọi người  xem,2020-06-02T06:28:00Z,0
top,p8KWdCzUHZM,Ugy7suCDauMUjKgixf14AaABAg,,@MINYOONGI-jx2qq,Giờ chị quỳnh k còn tym và tương tác nhiều như lúc trước nữa😔,2020-06-02T06:09:01Z,0
top,p8KWdCzUHZM,Ugz2HbVnkhRepAw7Ai94AaABAg,,@truongnhutnguyen5685,Trời ơi chị ăn hết cái măm này là chị mập lên vài trăm kí,2020-06-02T05:00:10Z,0
top,p8KWdCzUHZM,Ugzcrrd2jp09hRvihaV4AaABAg,,@MenNguyen-vk8mm,Chị quê hương ở đâu vậy,2020-06-02T04:01:34Z,0
top,p8KWdCzUHZM,UgwsN0EEmqY46g4ozst4AaABAg,,@aohavan9731,Nhin ngon hấp dẫn qua .,2020-06-02T03:40:26Z,0
top,p8KWdCzUHZM,UgyvZYOxjeZRj9pa6hp4AaABAg,,@letran3137,Thèm lắm cô ơi 🤤🤤🤤,2020-06-02T03:31:43Z,0
top,p8KWdCzUHZM,Ugxq81zoqTkUAcvopD94AaABAg,,@vuhoang-zu7ez,"Quay clip ngoi an van kiem duoc tien,tai nang that ,minh rat kham phuc",2020-06-02T02:57:55Z,0
top,p8KWdCzUHZM,UgzcHFXbwtv64iK6o2t4AaABAg,,@bintube5368,"Chào chị yêu nhé, nhìn các món ngon quá chị ơi, 👍🔔",2020-06-02T01:58:49Z,0
top,p8KWdCzUHZM,UgyTQl-4LGpztxIERHB4AaABAg,,@ngoc5655,Gio,2020-06-02T01:45:02Z,0
top,p8KWdCzUHZM,UgxAGzsbGz9v1_iuLCJ4AaABAg,,@ngoc5655,Giao,2020-06-02T01:44:31Z,0
top,p8KWdCzUHZM,Ugz2vXopfRFGRI1NImd4AaABAg,,@lylanyoutube6406,cua hoàng đế ngon xố dzách ăn mừng 3 tr sub,2020-06-02T01:13:32Z,2
top,p8KWdCzUHZM,Ugw89pc2ixq6nUb4VqZ4AaABAg,,@CarvingTuyếtNga-c4q,Great video thanks for sharing delicious sea food happy new day,2020-06-02T00:34:14Z,1
top,p8KWdCzUHZM,Ugzb0WwNfu-jXwZQhp54AaABAg,,@NhàCủaOanhCuộcsốngÚc,Nguyên cái mâm như một quầy ở chợ luôn . Ăn cả tuần cũng k hết luôn . Em phụ chị quá luôn ấy . Siêu khủng đó ai làm được cái mâm này mà ngồi ăn luôn ah .,2020-06-02T00:19:32Z,0
top,p8KWdCzUHZM,UgxOBxJDJXZ4QmkvJfd4AaABAg,,@namnguyenlq2650,Muốn coi clip của chị là fai ăn cơm no trc để coi chị ăn chịu ko nổi,2020-06-01T23:55:40Z,0
top,p8KWdCzUHZM,Ugyrk-rx52sk_0786Cp4AaABAg,,@caoninhquynh7425,Bh mới có tiền ăn con này nhỉ,2020-06-01T15:54:15Z,0
top,p8KWdCzUHZM,Ugx25k7uh1BdoGxkMSF4AaABAg,,@quocbaodinh5611,Chị có bị mỏi chân hong,2020-06-01T15:40:37Z,0
top,p8KWdCzUHZM,UgzJojOWwGhi9Y1HAnx4AaABAg,,@anchu614,số hưởng. mn coi thì thấy lãng phí nhưng mà chị cũng ăn hết mà có bỏ đâu nhỉ. 2 là ở nc ngoài thì rẻ ăn thoải mái thôi có gì đâu có điều kiện thì ăn thôi.,2020-06-01T15:35:53Z,0
top,p8KWdCzUHZM,UgzCcwX9sL9nOEEphv94AaABAg,,@truongsondoan5180,Gần cân được rồi,2020-06-01T15:24:36Z,0
top,p8KWdCzUHZM,UgznJLOj_Qt2MwMJpMZ4AaABAg,,@phamhongthan6021,Chời Ơi!<br>Ngon thế chời Ơi,2020-06-01T15:05:46Z,0
top,p8KWdCzUHZM,UgyJvZW5bV8KKqLDbVd4AaABAg,,@KhaiNgo,Chi sống ko phí cuộc đời này thiek,2020-06-01T14:38:31Z,0
top,p8KWdCzUHZM,UgzXJLfVp8dN-hiw4rh4AaABAg,,@haophan5072,An vay chac bi benh gut .,2020-06-01T14:29:06Z,0
top,p8KWdCzUHZM,Ugzb-wXCaqe72Po33SJ4AaABAg,,@ThongNguyen-iu3qm,Chị ơi em mới coi chị nên ko biết sao chị ăn đc trứng cá hồi vậy em coi mấy anh chị kia kiu là ghê lắm sao chị ăn dc v :))))),2020-06-01T14:25:33Z,0
top,p8KWdCzUHZM,UgxbXoVeFwXvMohYyat4AaABAg,,@KhaiNgo,"Em là e nể chị thiệk <br>Ăn khủng khiếp.mà ăn toàn món ngon.<br>Mơ dc an cua hoàng đế,bào ngư .....1 lan cho bc",2020-06-01T14:24:57Z,0
top,p8KWdCzUHZM,UgwhQ0p4vWAg6QaVmnp4AaABAg,,@hainamnguyen8550,thử ăn one chip đi,2020-06-01T14:15:32Z,0
top,p8KWdCzUHZM,Ugzydi0Cb8AI6KR_4Q14AaABAg,,@lypham-lifeinaustraliavlog7706,"Bung em luon con cao khi xem video cua chi.<br>Moi nguoi oi, em moi mo kenh youtube ve doi song o Uc, mong moi nguoi ung ho minh voi. Cam on moi nguoi",2020-06-01T13:54:54Z,0
reply,p8KWdCzUHZM,Ugzydi0Cb8AI6KR_4Q14AaABAg.99MmLV_7Trj9A7nAWerbrq,Ugzydi0Cb8AI6KR_4Q14AaABAg,@KinhThuc,mình cũng vậy nè👍❤,2020-06-20T14:44:55Z,0
top,p8KWdCzUHZM,Ugw1h3L4dROuoW7P7gN4AaABAg,,@anhduc-fz5cg,Không biết bao giờ mình mới làm được mâm thức ăn ntn cho ba mẹ mình thưởng thức nhỉ,2020-06-01T13:52:28Z,0
top,p8KWdCzUHZM,UgzW1ldNVQ1Aaukl8sR4AaABAg,,@hannguyen-nx8iu,"Chị ơi bàn đồ ăn nhìn ngon quá, em cũng thích cơi sơ chế nữa, mà ăn hải sản ko nên ăn chung với trái cây chua đâu ạ, rất nguy hiểm đó ạ",2020-06-01T13:39:55Z,0
top,p8KWdCzUHZM,Ugyd8EF0PViFEHpsl7x4AaABAg,,@huynhsang8794,"nhìn chị ăn thèm quá, em đi chế mì ăn đây",2020-06-01T13:35:37Z,0
top,p8KWdCzUHZM,UgyTL7-w8uO454e-rM14AaABAg,,@tamthanhtam5358,Yêu chị ghê,2020-06-01T13:35:19Z,0
top,p8KWdCzUHZM,Ugz5K4_BDOYZFZKVZG14AaABAg,,@dungphung1886,2  mẹ con xinh quá @@,2020-06-01T13:30:55Z,0
top,p8KWdCzUHZM,UgwgFJobggor2EjbZtt4AaABAg,,@thuuyennguyen4401,đợt này chơi lớn quá chị ơi,2020-06-01T13:21:46Z,0
top,p8KWdCzUHZM,UgwToHN_q7RMeUH0Voh4AaABAg,,@MỹViệtJA,Xem em này cũng lâu rồi rất đam mê,2020-06-01T13:20:37Z,0
top,p8KWdCzUHZM,UgwzCabZ1l1pl0mTYQN4AaABAg,,@VinhNguyen-nl9jo,Sao ông xã chị k ăn chung,2020-06-01T12:54:05Z,0
top,p8KWdCzUHZM,UgxG65iq0A7RzAtRJcd4AaABAg,,@ThangNguyen-mt7rz,Thèm,2020-06-01T12:52:39Z,0
top,p8KWdCzUHZM,UgwKZZ_fNerQsewRIed4AaABAg,,@nguyenhuyhoiofficial5349,Chị giỏi quá ngưỡng mộ thật mơ,2020-06-01T12:44:41Z,0
top,p8KWdCzUHZM,UgzW2FjS9k_rUe6bWm54AaABAg,,@nobigaming1379,"<a href=""https://www.youtube.com/watch?v=p8KWdCzUHZM&amp;t=354"">5:54</a> bé sa nói wua yamate",2020-06-01T12:27:46Z,0
top,p8KWdCzUHZM,UgyYpTEkXnjpmtzQjR14AaABAg,,@thuonghue3987,Sa ơi giống Jack quá,2020-06-01T12:13:16Z,0
top,p8KWdCzUHZM,Ugyd7CjzHlO6PVqgVgx4AaABAg,,@binhtamankhang5365,nhìn thì ngon thiệt - nhưng ăn 1 mình ko thấy ngán à,2020-06-01T12:11:16Z,0
top,p8KWdCzUHZM,UgxRKn194zVGKG3vBXR4AaABAg,,@anhthuho9770,nhin chị ăn ngon quá hihi,2020-06-01T12:06:36Z,0
top,p8KWdCzUHZM,Ugz623Nb_IYnt4Pxxep4AaABAg,,@nanguyenphamn2425,công nhận chị ở bên nhật sướng thật đó nha,2020-06-01T12:03:55Z,0
top,p8KWdCzUHZM,UgyeETMzcKUxuPp2wUN4AaABAg,,@calvinbroooo,l,2020-06-01T11:52:19Z,0
top,p8KWdCzUHZM,Ugw4WVLvFhXAkRoF-qh4AaABAg,,@nhizutaki3540,Lúc ăn hết mik lúc rữa hết hồn 🤣🤣😂🤣😂🤣😂,2020-06-01T11:47:07Z,1
top,p8KWdCzUHZM,UgyCj9olPlVm0IsG1-V4AaABAg,,@tuluong3313,Ăn một bữa nữa năm tiền lương của dân thường ở vn lun á tr,2020-06-01T11:40:33Z,0
top,p8KWdCzUHZM,UgwHEITF6Q9Qf9jAZ4x4AaABAg,,@uyenuyen6928,Sao bỏ Sa vô cái thùng dễ thương quá à🤗,2020-06-01T10:53:47Z,0
top,p8KWdCzUHZM,UgwY1JMjdi5dWYznqs54AaABAg,,@camtu3785,Ăn cho má nghèo luôn ha gì mà ăn thấy sợ z tr,2020-06-01T10:49:35Z,0
top,p8KWdCzUHZM,Ugwm9qCqVSvVZwYqp6p4AaABAg,,@lanlam4252,Quỳnh ơi nam nay chi bao nhiêu tuoi roi nhìn chi an ma them luon a chi yeu chi,2020-06-01T10:48:03Z,0
top,p8KWdCzUHZM,UgzBg-ZO0fTKvjxp0bF4AaABAg,,@maky9999,Xem vui thôi chứ không thích. Xem Chị chán lắm vì nhìn Chị ăn thèm không chịu dc.,2020-06-01T10:22:01Z,0
top,p8KWdCzUHZM,UgxTAjcl-k1hZ72vk8B4AaABAg,,@anhnguyen-px1pk,chúc mọi điều may mắn sẽ đến với Quỳnh &lt;3,2020-06-01T10:15:11Z,0
top,p8KWdCzUHZM,Ugw8RWLgZl51BvUKNwR4AaABAg,,@BếpNhàEm,"ôi hải sản tươi ngon quá chị ạ, chúc mừng thành công của chị",2020-06-01T09:56:35Z,6
reply,p8KWdCzUHZM,Ugw8RWLgZl51BvUKNwR4AaABAg.99MM47-84GC99Rye_BE11N,Ugw8RWLgZl51BvUKNwR4AaABAg,@TienNguyen-lo9gn,Anh yủ rèm lo ve 31648542,2020-06-03T14:18:41Z,0
top,p8KWdCzUHZM,Ugw0O8v8zFd6vA1fBs94AaABAg,,@lutran6596,Chắc ăn đến tuần sau mới hết😂😂😂,2020-06-01T09:51:11Z,0
top,p8KWdCzUHZM,UgyN4MbfVIHyMtKQ4s54AaABAg,,@phongphi8425,Quá hấp dẫn OK link 🙆👍👍👍👌,2020-06-01T09:37:14Z,0
top,p8KWdCzUHZM,Ugy4_Ai5Y9F78amPvxh4AaABAg,,@toanthanh6205,"<a href=""https://www.youtube.com/watch?v=p8KWdCzUHZM&amp;t=356"">5:56</a> yamante kkk",2020-06-01T09:34:20Z,0
top,p8KWdCzUHZM,UgyepQkVggMq3rZqFMh4AaABAg,,@hoaminh2012,Chị ăn đc nhiều dã man 🤧🤧🤧,2020-06-01T09:30:33Z,0
top,p8KWdCzUHZM,Ugw6kWUIA6R5ov3ktTt4AaABAg,,@meagust-,"Em nói thật, chị Quỳnh làm YTber nói chuyện dân dã gần gũi nè, ghi hình cũng hong có cần makeup lồng lộn nhưng mà vẫn xinh lung linh luôn, em u mê chị lắm luôn, replay video này lần thứ 5 trong tuần 🤤",2020-06-01T09:04:52Z,0
top,p8KWdCzUHZM,UgwDeNNL3UyrC1pC7WR4AaABAg,,@duc2igh467,ai ước j dc an như bả 1 lần điểm danh,2020-06-01T08:59:30Z,1
top,p8KWdCzUHZM,UgwJ6eiDL6naBjOfYhx4AaABAg,,@anhgia1470,"C ơi, c đi chợ Hải sản ở chỗ nào thế ạ",2020-06-01T08:57:52Z,0
top,p8KWdCzUHZM,Ugy5ztEfcZeG2PxQ6A94AaABAg,,@bichvanluu4114,"Q an gioi lam cug gioi xuất sắc, yummy yummy",2020-06-01T08:43:04Z,0
top,p8KWdCzUHZM,UgwRh1TexJPSjeZ3iql4AaABAg,,@trienho8999,Béo chết mất quỳnh oi,2020-06-01T08:38:44Z,0
top,p8KWdCzUHZM,UgwzcvVtJoKcQUUytrh4AaABAg,,@gatrongvlog6625,bach tuoc mua ca con bao nhieu chi,2020-06-01T08:25:04Z,0
top,p8KWdCzUHZM,Ugy2gCSDcgB88QxVcTt4AaABAg,,@tuyetthitrinh2599,E thấy chị rất giỏi chọn đồ ăn rất tươi và khâu vệ sinh nấu nướng rất kỹ .,2020-06-01T08:06:59Z,1
top,p8KWdCzUHZM,Ugyv_U-V4B33KYsjwCB4AaABAg,,@phuho5981,Con của  em hả dễ thương lắm đó em ơi,2020-06-01T07:18:36Z,0
top,p8KWdCzUHZM,UgxoS-d1zTMNoxOpbnt4AaABAg,,@phuho5981,Chuc em thanh cong nha em ơi,2020-06-01T07:17:44Z,0
top,p8KWdCzUHZM,UgyFpEj2aFXrrnxvKEZ4AaABAg,,@khanhlequoc5039,Bên Nhật đàn ông bán hàng kh ha,2020-06-01T06:52:33Z,0
top,p8KWdCzUHZM,UgytgLSTkaPC4CLS3P54AaABAg,,@truclytruongthi4978,"Lần đầu xem mà thích chi này gê lun, bả hài deso",2020-06-01T06:12:58Z,0
top,p8KWdCzUHZM,UgxqTPvwRMtzVF9mXXB4AaABAg,,@ThaoLe-xv8ty,Cô Quỳnh chơi lớn thật ấy ạ❤,2020-06-01T05:27:36Z,0
top,p8KWdCzUHZM,UgwAOziG4L4Y-XoaLKt4AaABAg,,@leha2915,Thử ăn trứng vịt lộn ik cô,2020-06-01T05:25:30Z,0
top,p8KWdCzUHZM,UgyESWnM0YEtrHKIOzp4AaABAg,,@crayon.shinchan,Hết chỗ đó bao nhiêu chị......,2020-06-01T05:23:56Z,0
top,p8KWdCzUHZM,UgwSt80kjkCulfU7KLV4AaABAg,,@quanglam5917,Cô thử quay clip ăn chung vs chồng cô đi gia đình đông vui,2020-06-01T04:47:02Z,0
top,p8KWdCzUHZM,UgxFAzzIZx5RXsks3BN4AaABAg,,@hoaian2974,Vừa xem vừa chảy dãi,2020-06-01T03:52:51Z,1
top,p8KWdCzUHZM,UgziIONphjJAzH20k8J4AaABAg,,@HuyenTran-hi6gh,Kinh ! vãi cả ăn :,2020-06-01T03:44:34Z,0
top,p8KWdCzUHZM,UgzQ297d1knbVJB0WId4AaABAg,,@cuulethi1165,nhin be dang yeu qua,2020-06-01T03:41:15Z,0
top,p8KWdCzUHZM,UgyUZ-ccfVY3jkXHHPV4AaABAg,,@quanan1579,Nhìn miệng e ăn mà thèm giữ lắm luôn nhưng làm gì mua nỗi nhìn e ăn cho đỡ thèm,2020-06-01T03:30:11Z,0
top,p8KWdCzUHZM,UgxCoKCPq6xXY1CoorZ4AaABAg,,@quanan1579,Con người có số người ăn không cũng có tiền còn tui làm mù đầu mà chưa bao giờ được ăn ngon như vậy,2020-06-01T03:28:30Z,0
top,p8KWdCzUHZM,UgxJGAG9gQigK1ogex14AaABAg,,@quyetnguyen209,Người ăn không hết kẻ nần chẳng ra là đây :)),2020-06-01T03:08:08Z,0
top,p8KWdCzUHZM,UgxmyhwS0R2kqWXzUYN4AaABAg,,@ToNy-yb1ho,"<a href=""https://www.youtube.com/watch?v=p8KWdCzUHZM&amp;t=1144"">19:04</a> chắc nhiều anh thốn lắm😌",2020-06-01T03:00:53Z,5
reply,p8KWdCzUHZM,UgxmyhwS0R2kqWXzUYN4AaABAg.99LbVMaJpfx9BKmv1UEIB3,UgxmyhwS0R2kqWXzUYN4AaABAg,@kidkaito4780,Ghê quá,2020-07-20T12:24:11Z,0
top,p8KWdCzUHZM,UgxdyKA25QQpz0B4PGx4AaABAg,,@dogstakecarecenter6577,Chúc chị càng ngày càng làm ra nhiều video hay hơn nữa,2020-06-01T00:32:51Z,0
top,p8KWdCzUHZM,UgzpnfZmPljgKXuDMoR4AaABAg,,@クリちゃま,Mỗi video bà nói câu “mời mọi ng ăn chung với mình nha” thì tui lại thấy đau lòng vãi 😩😩😩,2020-05-31T19:39:21Z,2
top,p8KWdCzUHZM,UgzZanvpFDFSH5afvK54AaABAg,,@sonngo2042,Ươc 1 lần được như Chị 😰,2020-05-31T19:26:35Z,0
top,p8KWdCzUHZM,UgyCQhRjbD_Y4H78S2R4AaABAg,,@phuongvlog7414,Mở ước dk ăn hải sản,2020-05-31T17:57:02Z,0
top,p8KWdCzUHZM,UgxujkK02EMrj4bsaOh4AaABAg,,@huongchu3391,Chị mua muối tây ninh màu xanh thử xem. E thấy muối tây ninh màu xanh ăn rất ngon. E thích hơn màu muối của chị đang ăn.,2020-05-31T17:38:57Z,0
top,p8KWdCzUHZM,UgwCHNdZJlTXX4axrY14AaABAg,,@VanAnhNguyen-pd5sk,moi sa bi gi v,2020-05-31T17:37:34Z,0
top,p8KWdCzUHZM,UgzGMA4Yo2rK69EY7A14AaABAg,,@thunhung7224,Cá chai đó chị,2020-05-31T17:17:48Z,0
top,p8KWdCzUHZM,UgxnDk8F2axe8wrUfh94AaABAg,,@phammydung7011,Mình rất thích nhìn cách bà Quỳnh sơ chế hải sản. Cảm giác là con gì bả cũng biết làm hết ó,2020-05-31T16:58:48Z,0
top,p8KWdCzUHZM,UgzSAnVRiFtjqRy1e_h4AaABAg,,@tuananhle5532,Người miền Tây là vậy,2020-05-31T16:54:00Z,0
top,p8KWdCzUHZM,Ugww6zHYnx7rbyE6OEl4AaABAg,,@tuananhle5532,Ăn vậy bao giờ chết,2020-05-31T16:52:57Z,0
top,p8KWdCzUHZM,Ugz0i8E6I5LWLwlof514AaABAg,,@lynnnguyen992,Lúc đầu em không để ý là Sa ở trong cái thùng đó luôn ý =(((,2020-05-31T16:45:04Z,0
top,p8KWdCzUHZM,Ugy35M5oLg34u-lVjSB4AaABAg,,@Tuilahuynday,Mấy yter làm mukbang khác toàn son phấn loè loẹt xong mới ăn nhìn mà sợ còn chị Quỳnh ko make up ăn uống nhìn ngon lành giản dị vch =)),2020-05-31T16:43:20Z,18
top,p8KWdCzUHZM,Ugw68JIXKtert4xH59F4AaABAg,,@hieuquang5826,13tr mâm này vậy 1 video dc bao nhiêu tiền mà đầu tư nhiêu vậy ta,2020-05-31T15:53:56Z,0
top,p8KWdCzUHZM,UgxWZ3BD6Q4axDf-qaZ4AaABAg,,@VanNguyen-xf4mg,"Ăn dư thế lày 10ng ăn cũng hổng hết ý. Bà lày số hưởng, lúc nào cũng 1 mâm tú ụ sơn hào hải vị. Thấy gato với e quá 😜😝😛🤤",2020-05-31T15:39:31Z,0
top,p8KWdCzUHZM,UgxZlsp53ccTI25BrQx4AaABAg,,@ctgaming5716,Ngon qua chi huynh oi,2020-05-31T15:30:48Z,0
top,p8KWdCzUHZM,UgxEEeM3wzSVeZMCLsx4AaABAg,,@phangchoachumi725,I loved the market its found all kind of seafood,2020-05-31T15:30:45Z,1
top,p8KWdCzUHZM,UgxyLNAvZd-T1If_XYh4AaABAg,,@athunter7342,Vãi bên nhựt mà cx có muối tây ninh luôn à????,2020-05-31T15:09:51Z,0
