type,video_id,comment_id,parent_id,author,text,published_at,like_count
top,p8KWdCzUHZM,UgzdpHJA71Sbh0gaKe54AaABAg,,@trieuhuongvlog9868,Chị quỳnh ơi.chị lm món sò huyết mở hành đi ạ,2020-05-25T03:23:49Z,0
top,p8KWdCzUHZM,UgwS40mIyex-FoCyWkl4AaABAg,,@nguyenthimaitram9029,Chúc mừng em,2020-05-25T03:23:24Z,0
top,p8KWdCzUHZM,UgxNUzWf3OEsFbb1SNh4AaABAg,,@hongnhung10đ,Cô làm mâm bánh tráng trộn đi,2020-05-25T03:21:44Z,0
top,p8KWdCzUHZM,Ugx4atS0R-HSTHphqV14AaABAg,,@DuongPham-lm7js,Bún bò Huế đi chị ơi,2020-05-25T03:21:13Z,0
top,p8KWdCzUHZM,UgzwpOHYCy5cgCn_f4N4AaABAg,,@phamquangthong8321,cua chị đặt trên wed nào vậy c,2020-05-25T03:19:28Z,0
top,p8KWdCzUHZM,UgxDCiPulLJPVzdBUfp4AaABAg,,@lanhle7881,Chỉ ăn luôn cả thế nào còn được,2020-05-25T03:19:25Z,0
top,p8KWdCzUHZM,UgzR2Ngre028Hz1-bod4AaABAg,,@sonky8944,Bay ra mam nhu vay rat dep,2020-05-25T03:19:04Z,0
top,p8KWdCzUHZM,UgwW6gSRU02LPlWJTF54AaABAg,,@TuanLe-hs8iy,Làm cả mâm mất cả ngày lun ớ... thiệt kì cônv,2020-05-25T03:17:57Z,0
top,p8KWdCzUHZM,Ugwv0ea45ycuY3mwE3N4AaABAg,,@NhungNhung-td7wq,Chúc mừng chị Quỳnh ạ :)),2020-05-25T03:17:39Z,30
reply,p8KWdCzUHZM,Ugwv0ea45ycuY3mwE3N4AaABAg.993br65jEPh994fOjh5bvs,Ugwv0ea45ycuY3mwE3N4AaABAg,@HiepNguyen-bi3we,Ăn gì mà khỏe vãi,2020-05-25T13:07:50Z,0
reply,p8KWdCzUHZM,Ugwv0ea45ycuY3mwE3N4AaABAg.993br65jEPh994hO3Emkj5,Ugwv0ea45ycuY3mwE3N4AaABAg,@ngothianhtho5477,🙂,2020-05-25T13:25:13Z,0
top,p8KWdCzUHZM,Ugw6_PSvaE4LeUSmyYR4AaABAg,,@ut1328,Hôm nay đúng chất mâm hải sản luon đó chị ...🤩🤩🤩💓,2020-05-25T03:15:34Z,0
top,p8KWdCzUHZM,Ugz-sPnK5MckWVSZ5wl4AaABAg,,@honhathuy3394,Mong chi tuong tac kenh cua e,2020-05-25T03:14:49Z,0
top,p8KWdCzUHZM,UgyX5EhynoH-I-7WT6J4AaABAg,,@mythole3766,Thiệt ngưỡng mộ chị,2020-05-25T03:14:29Z,0
top,p8KWdCzUHZM,UgxxULzsYltPULgApC14AaABAg,,@nghiahoang4898,Bà nầy hoang quá,2020-05-25T03:13:36Z,0
top,p8KWdCzUHZM,UgzJlQk_98zfPOaVA0R4AaABAg,,@cuongkim5930,Con ốc vòi voi 😂😂😂😂 k thê nao trog sang duoc,2020-05-25T03:12:18Z,0
reply,p8KWdCzUHZM,UgzJlQk_98zfPOaVA0R4AaABAg.993bEp3nmwq994dRpaWSJ-,UgzJlQk_98zfPOaVA0R4AaABAg,@quyhaiminh3936,"Thật sự , còn lột da nữa chứ",2020-05-25T12:50:47Z,0
top,p8KWdCzUHZM,Ugy2QUPmIwsr-yh7tzd4AaABAg,,@minhmanto1930,"Con này ăn giống mấy con Trung Quốc ăn con dơi,  đồ thứ chết đói hồi nhỏ bây giờ qua đây ăn thấy gớm. Ăn dồn vô cái miệng như cái lỗ đích vịt,  sau này mở trong máu cho mày biết.",2020-05-25T03:10:41Z,0
top,p8KWdCzUHZM,UgylfP6bDF5skw5cotp4AaABAg,,@diepnguyen2636,"<a href=""https://www.youtube.com/watch?v=p8KWdCzUHZM&amp;t=1021"">17:01</a> trắng tinh như ngọc trinh😂😂😂",2020-05-25T03:10:25Z,2
reply,p8KWdCzUHZM,UgylfP6bDF5skw5cotp4AaABAg.993b12QfMS7993gdFLoU3a,UgylfP6bDF5skw5cotp4AaABAg,@yeon6492,🤣🤣🤣,2020-05-25T03:59:27Z,0
top,p8KWdCzUHZM,Ugy6k8lbzzXP3_guGqR4AaABAg,,@fannhungdayy2226,Coi xong r ăn mì tôm cho có vị hải sản 😰,2020-05-25T03:10:02Z,1
top,p8KWdCzUHZM,UgwwRjmRkjqkjCMX2CJ4AaABAg,,@QR0900,Xem clip chỉ vì con bé đầu nấm kế bên....kkk.....,2020-05-25T03:05:58Z,0
reply,p8KWdCzUHZM,UgwwRjmRkjqkjCMX2CJ4AaABAg.993aWWzjbSa994JuJZ61RS,UgwwRjmRkjqkjCMX2CJ4AaABAg,@hauvan664,Nhìn thấy bà Quỳnh ăn con ốc mà 🐚🐚 thấy thương chị quá ❤❤❤,2020-05-25T09:51:18Z,0
top,p8KWdCzUHZM,UgydQUOY4-ExnjrdXCJ4AaABAg,,@duonghuyen681,chị nấu phở bò Hà Nội đi ạk. vì e cũng ở HN .. hihi😊😊😊,2020-05-25T03:05:15Z,3
top,p8KWdCzUHZM,Ugz13YMEGOGZlj80tm54AaABAg,,@maitran3433,Chị đặt máy quay xa quá chị ơi<br>Em hôg thấy j hết,2020-05-25T03:03:14Z,0
top,p8KWdCzUHZM,UgyyIIpgs2g-U42tt8l4AaABAg,,@KentNguyen28311,Ngưỡng mộ chị ghê ;)),2020-05-25T03:03:09Z,0
top,p8KWdCzUHZM,UgyQ2yvyayy0uFAPn0d4AaABAg,,@ToLamPhuongNghi,Chúc mừng Quỳnh nha ♥️♥️♥️♥️♥️,2020-05-25T03:02:07Z,0
top,p8KWdCzUHZM,UgxdthxaUFhDP3n84LZ4AaABAg,,@thuongthe38,"Chúc mừng mẹ con quỳnh nha,yêu nhiều",2020-05-25T02:59:04Z,0
top,p8KWdCzUHZM,UgxR-XuRGfMs9RsVMo94AaABAg,,@amynguyen147,Chuc mung em duoc 3 trieu sub nhin them qua,2020-05-25T02:58:47Z,0
top,p8KWdCzUHZM,UgzOakUEtNQeIGaLI8V4AaABAg,,@LanTran-rn9dt,Quynh oi wa xa da tren ca tuyet chuc 2me con va gd nhieu suc khoe vv hp trang ngap tieng cuoi nha,2020-05-25T02:58:34Z,0
top,p8KWdCzUHZM,Ugwggw3s5tx20e1lqTd4AaABAg,,@LanNgoc-fp3uh,Nhieu đồ ăn ngon quá. An sao het ta,2020-05-25T02:57:01Z,0
top,p8KWdCzUHZM,UgzFFvDcaIFSa8pzitt4AaABAg,,@nhungluong2228,"nhin ngon qua quynh oi ,thay la them",2020-05-25T02:56:52Z,0
top,p8KWdCzUHZM,Ugwcg4NgIC8be4Ka14N4AaABAg,,@luannguyenminh9743,Haiyaaof,2020-05-25T02:55:43Z,0
top,p8KWdCzUHZM,UgyKrrgjyRlGSHmyQPt4AaABAg,,@nguyenhongnhung8017,Chúc mừng chị nha...chúc chị ngày càng thành công<br>- mỗi khi không có gì ăn em lại xem video của chị cho đỡ thèm..xem xong lại càng thèm 🤣🤣,2020-05-25T02:53:31Z,0
top,p8KWdCzUHZM,UgwO9QKN6m3svOss5M94AaABAg,,@boboofficial5952,"Hôm nay cô Quỳnh chơi lớn wá ,ăn một cái mâm tận 13triệu <br>🐬🐙🍸🐚🍴🍳🍤🍣🍥",2020-05-25T02:53:30Z,5
top,p8KWdCzUHZM,UgwHS_d0GNjB8aC2o9J4AaABAg,,@cuocvlog2305,"Chi oi chi lam thang đc may tram trieu tien Việt nam vay chi.. ma thay chi mua nhiu đo an vay chi,,",2020-05-25T02:52:00Z,0
top,p8KWdCzUHZM,Ugw_5PFTvAewoxfAExt4AaABAg,,@tranghuynh8113,Trời c ăn tiệc bửa bằng e ăn mấy tháng ln,2020-05-25T02:51:28Z,0
top,p8KWdCzUHZM,UgxaMB2CWlfk71oUH3l4AaABAg,,@channel-uq6wo,Hi😊,2020-05-25T02:51:27Z,0
top,p8KWdCzUHZM,Ugw41IVCRaDlxPf9tV54AaABAg,,@kieunguyen8101,"Ui ngon quá chị quỳnh ơi , sa ăn cute 😍 quá 😘",2020-05-25T02:48:39Z,3
top,p8KWdCzUHZM,Ugy2FhAOMo-tBBD9kOp4AaABAg,,@trinhbui6588,E chờ hoài mới thấy chị quỳnh làm video ăn mừng 3tr,2020-05-25T02:45:32Z,0
top,p8KWdCzUHZM,UgxtMmSfhkhSi8uVXsV4AaABAg,,@huyentruong7664,"Chị sơ chế mọi thứ đều rất sạch sẽ,thích ghê luôn",2020-05-25T02:43:45Z,0
top,p8KWdCzUHZM,UgwD3nFLKFL_iFuROs14AaABAg,,@sunch1322,Ngon quá,2020-05-25T02:42:52Z,1
top,p8KWdCzUHZM,UgzE-Pxq-bxakxmRzNV4AaABAg,,@UwU-nu3zu,🎉,2020-05-25T02:42:47Z,0
top,p8KWdCzUHZM,Ugwa8_HpvDGwVy9HV6h4AaABAg,,@nhungluong5157,Hết sẩy con bà bảy ngon tuyệt vời luôn 🌹🌹🌹,2020-05-25T02:41:27Z,0
top,p8KWdCzUHZM,UgzYR4iCVMToMjBYFVh4AaABAg,,@trammeotv7714,Làm hết mớ này chắc cả ngày,2020-05-25T02:40:21Z,0
top,p8KWdCzUHZM,Ugz58gdom8UFAQQfZe54AaABAg,,@minhthovo8780,"<a href=""https://www.youtube.com/watch?v=p8KWdCzUHZM&amp;t=138"">2:18</a> chị Quỳnh nói chuyện với anh bán hàng khi mua ốc vòi voi là đưa cái gúi đây coi😊😃😄😅",2020-05-25T02:39:24Z,2
top,p8KWdCzUHZM,UgwCzkKiMq4rpgiiFUR4AaABAg,,@thidieulienle8197,Cô ơi cô nói về việc 3triệu ng đăng ký   1tháng bao nhiêu tiền youtube đi cô,2020-05-25T02:37:58Z,0
top,p8KWdCzUHZM,UgzPWR8X0yu_3WyRXkl4AaABAg,,@PhongPham163,Chợ nhìn sạch sẽ còn chợ ở Việt Nam thì...,2020-05-25T02:37:16Z,0
top,p8KWdCzUHZM,UgyhTG_-UUL4Jeu1wx94AaABAg,,@ngocnguyenthanh3820,Nhìn c ăn mà phát thèm😂,2020-05-25T02:35:45Z,0
top,p8KWdCzUHZM,UgzDR-gbUqXSrDxjy1N4AaABAg,,@ngaha6264,Cưng sa ghê,2020-05-25T02:34:35Z,0
top,p8KWdCzUHZM,Ugwt03IFduR0-J8SpnR4AaABAg,,@kimoanhtran4274,Quỳnh và pasa nặng 101 kí,2020-05-25T02:34:27Z,1
top,p8KWdCzUHZM,UgznhUOYdS4Lkt0fljd4AaABAg,,@nganpham-vp3qp,Chảy hết nước miếng rồi bà quỳnh ơi 😋😋😋,2020-05-25T02:32:32Z,0
top,p8KWdCzUHZM,UgzNjwCMuAGX0IFq9C14AaABAg,,@c.dinjapan7144,Chị chỉ em trang nào đặt con cua đc ko chị?,2020-05-25T02:32:03Z,0
top,p8KWdCzUHZM,Ugx1TTFj_tj0TEg5hbR4AaABAg,,@kietkiet74,C gái ơi chợ Hải sản ở dau a,2020-05-25T02:32:00Z,0
top,p8KWdCzUHZM,UgwystDGsVxXNeRNtrh4AaABAg,,@HuyenMy17-25,Chị Quỳnh quên ốc vòi voi rồi ạ. Sơ chế ăn sashimi mà ta 😂😂😂,2020-05-25T02:30:29Z,19
reply,p8KWdCzUHZM,UgwystDGsVxXNeRNtrh4AaABAg.993XSd7Be6U993jKrO1-51,UgwystDGsVxXNeRNtrh4AaABAg,@khang._3495,Có mà,2020-05-25T04:23:01Z,0
reply,p8KWdCzUHZM,UgwystDGsVxXNeRNtrh4AaABAg.993XSd7Be6U993lD4zG-o0,UgwystDGsVxXNeRNtrh4AaABAg,@NhiNguyen-iy9rl,@khang._3495 ở đoạn nào có ăn ốc vòi voi z b?,2020-05-25T04:39:26Z,0
top,p8KWdCzUHZM,UgwZtFlv2XhNSeBxOiZ4AaABAg,,@hoangoanhnguyenthi9866,"Được 3tr Sub vậy là dc bao nhiu tiền vậy Q, chúc mừng nha",2020-05-25T02:30:15Z,0
top,p8KWdCzUHZM,UgyB7BQ-dChtuQIruvx4AaABAg,,@loanly416,Chi thật giỏi  lam nhung may mon  thật ngon,2020-05-25T02:30:05Z,0
top,p8KWdCzUHZM,UgyY6BROcrGl-O0Sr7Z4AaABAg,,@thanhngan3439,Cái mỏ bé Sa tíu vãi 😂,2020-05-25T02:29:55Z,0
top,p8KWdCzUHZM,Ugz2nDMSb8ALlivlvp94AaABAg,,@ngonta2794,Dược tặng quà gì ha chị e thít quà của nhật lắm,2020-05-25T02:29:53Z,0
top,p8KWdCzUHZM,Ugzo0IUSG8B0l3vcziB4AaABAg,,@thuytruc5152,"Chị khéo tay quá,món nào nhìn cũng thèm hết 🤤🤤😊😊",2020-05-25T02:29:21Z,1
top,p8KWdCzUHZM,Ugzn8vNeuyW61T3-tAN4AaABAg,,@thuha210,Chúc mừng chị 🥳,2020-05-25T02:28:44Z,0
top,p8KWdCzUHZM,UgziNr0DkfNe7Lp9PvB4AaABAg,,@trunggsatoru4804,Chị ơi ăn bọ biển đi,2020-05-25T02:27:56Z,0
top,p8KWdCzUHZM,UgxgT4yF-eSBeKfstLh4AaABAg,,@tranphuonganh6237,😍😍😍😍😍😍😍😍😍😍😍😍😍,2020-05-25T02:27:44Z,0
top,p8KWdCzUHZM,UgwfP2v5onx2mcZRuSV4AaABAg,,@loanly416,Nhìn chi an con qua,2020-05-25T02:27:16Z,0
top,p8KWdCzUHZM,Ugx3821oKQ2GEYv4n8J4AaABAg,,@vantinhchao3760,Nhieu co quyenh an het dc ko,2020-05-25T02:26:30Z,0
top,p8KWdCzUHZM,UgzJEkYc1SXJZ120eut4AaABAg,,@吳庭坊-u2n,"Nhin cach trang tri thoi la da con mat roi nha hjhj, chuc mung ba quynh nhe",2020-05-25T02:26:28Z,0
top,p8KWdCzUHZM,UgwFfHazZVyDzUF6u054AaABAg,,@hocamnhung3263,Tuyệt vời,2020-05-25T02:25:44Z,0
top,p8KWdCzUHZM,UgzgbiqrNCBOSOeePAV4AaABAg,,@dungdung1811,Video của chị quỳnh cái nào cũng đầu tư  💓,2020-05-25T02:24:16Z,0
top,p8KWdCzUHZM,UgxZH0qF54ryGqRYpQ54AaABAg,,@thuhoai5860,VIDEO CHẤT LƯỢNG NÓI CHUYỆN DUYÊN DÁNG THÍCH CHỊ QUỲNH NHẤT,2020-05-25T02:22:35Z,0
top,p8KWdCzUHZM,UgxaN3RWNSmCFTrjU394AaABAg,,@pemy2243,Nhin kĩ ms thấy bé sa😅,2020-05-25T02:22:08Z,0
top,p8KWdCzUHZM,UgwLveECp0k_iz17oQ14AaABAg,,@hieuduongvlog1196,Nhìn đã quá đi thôi. Chúc chị và gia đình luôn vui vẽ và hạnh phúc .chúc kênh luôn phát triển..<br>Cho e ké tý. Bên kênh e củg đngblafm về ẩm thức và cảnh đẹp quê e xin mọi người sang xem và ủg hộ ạk,2020-05-25T02:22:04Z,0
top,p8KWdCzUHZM,UgwkI_wTveeXpaTYAgN4AaABAg,,@thanhluanvo5709,Nhìn ngon quá cô ơi,2020-05-25T02:18:34Z,0
top,p8KWdCzUHZM,UgzmAft_7gdyUWvb1Gd4AaABAg,,@cuckpa2681,Mình là ng rất thích ăn hs <br>Ai như mình hơm nè 😉,2020-05-25T02:17:48Z,1
top,p8KWdCzUHZM,Ugy5_oMEDP6IqVLQwhR4AaABAg,,@MienTayoiThuong71,Chúc mừng chế nhé! Kênh e chỉ mong lên lên có ae nào youtuber thì ghé unge hộ nhau,2020-05-25T02:16:06Z,6
top,p8KWdCzUHZM,Ugzmx8mWz1V_MWrvQit4AaABAg,,@minamot2003,Hi,2020-05-25T02:14:23Z,0
top,p8KWdCzUHZM,UgwniPKp54w_if8_D5x4AaABAg,,@namdungnguyen4044,Vi déo nhìu phút nhất của bà quỳnh,2020-05-25T02:13:47Z,0
top,p8KWdCzUHZM,UgxGgouP8IjUh3Hv3B94AaABAg,,@quynhnguyen1798,mừng 3tr mà mua mâm hải sản 13tr <br><br><br><br>Mãi yêu cj Q và sa,2020-05-25T02:13:41Z,114
reply,p8KWdCzUHZM,UgxGgouP8IjUh3Hv3B94AaABAg.993VXXUIWEg993iQvpFCim,UgxGgouP8IjUh3Hv3B94AaABAg,@ThuyNguyen-dd7vb,Mk nghĩ Tiền việt với nhật trị giá nó khác nhau,2020-05-25T04:15:07Z,0
reply,p8KWdCzUHZM,UgxGgouP8IjUh3Hv3B94AaABAg.993VXXUIWEg993jpSSwbL_,UgxGgouP8IjUh3Hv3B94AaABAg,@tbcolby1998,@ThuyNguyen-dd7vb Khác nhau nhưng vẫn là nhiều đó bạn!! Vì mệnh giá khác nhau nhưng số chi phí phải chi trả cho việc trang trải cũng không ít hơn mình đâu,2020-05-25T04:27:20Z,5
reply,p8KWdCzUHZM,UgxGgouP8IjUh3Hv3B94AaABAg.993VXXUIWEg993nUVz5UI8,UgxGgouP8IjUh3Hv3B94AaABAg,@hoangdung9526,@ThuyNguyen-dd7vb mà tiền quỳnh kím đc cũng lấy tiền việt đổi ra nhật cũng ko đc nhiều,2020-05-25T04:59:17Z,0
reply,p8KWdCzUHZM,UgxGgouP8IjUh3Hv3B94AaABAg.993VXXUIWEg993osqf93EK,UgxGgouP8IjUh3Hv3B94AaABAg,@vuong3165,"Ăn thì ăn cho bả chứ ăn cho ai đâu mà nhiều tiền với ít tiền<br>Nó ăn thì béo nó, bỏ tiền ra ăn cho bả chứ cho ai mà bàn luận thừa<br>Lo làm giàu đi",2020-05-25T05:11:29Z,4
reply,p8KWdCzUHZM,UgxGgouP8IjUh3Hv3B94AaABAg.993VXXUIWEg9Dh2YfMDNEf,UgxGgouP8IjUh3Hv3B94AaABAg,@tinhbui2895,Mâm này ở vn ko biết bao tiền nguyên con cua cung phải hơn chục triệu là ít,2020-09-17T06:14:52Z,1
top,p8KWdCzUHZM,UgyNhGyrVWDL28Xqfph4AaABAg,,@hoangminhle3320,ngon nhỉ,2020-05-25T02:13:22Z,0
top,p8KWdCzUHZM,UgwBgxyRB2SX1hGfOf94AaABAg,,@nhile-xy3hu,"Em xem nhiều video mukbang lắm mà chỉ thấy video của chị Quỳnh là sơ chế vs nấu món ăn tỉ mỉ nhất luôn á, chúc mừng chị đạt được 3M sub nha~",2020-05-25T02:11:33Z,0
top,p8KWdCzUHZM,UgyA6tdk0Lvn0zMKV894AaABAg,,@nhole5862,Quynh ơi...chi rât thich xem kênh cua em.<br>nhưng hôm nay chi xem em ăn nhiêu loai hai san.nhiêu thư qua làm chi bi ngán hong thèm ăn như moi lân em ah.,2020-05-25T02:11:33Z,0
top,p8KWdCzUHZM,UgxArLrGE6x0dSbyrx14AaABAg,,@phuochoa4832,🤗🤗🤗🤗🤗,2020-05-25T02:10:35Z,0
top,p8KWdCzUHZM,Ugz7558Vyw4IdBwRv6R4AaABAg,,@phuochoa4832,Chỉ làm video thăm quan nhà của chị ik,2020-05-25T02:10:19Z,0
top,p8KWdCzUHZM,UgznVV_BGZz1al74htR4AaABAg,,@anhchan-cuocsonghangngayon8515,Mấy a nhật ở chợ cá bảo c là youtober à <br>Tháng kiếm 50 man phải ko :)),2020-05-25T02:09:28Z,3
reply,p8KWdCzUHZM,UgznVV_BGZz1al74htR4AaABAg.993V2epbUxI993r_9iHRZJ,UgznVV_BGZz1al74htR4AaABAg,@tientien5461,50 man là bn tiền việt vậy ạ?,2020-05-25T05:35:01Z,0
reply,p8KWdCzUHZM,UgznVV_BGZz1al74htR4AaABAg.993V2epbUxI9941o8vaea9,UgznVV_BGZz1al74htR4AaABAg,@phanphan1379,tiên tiên là hơn 100tr đó bạn,2020-05-25T07:13:11Z,0
top,p8KWdCzUHZM,Ugw-FkOCWKBkn4F8-t54AaABAg,,@xiunguyen7421,Hôm trước sao chờ video của Quỳnh mà ko thấy,2020-05-25T02:08:23Z,0
top,p8KWdCzUHZM,Ugz4OcrNed_vvhjxXPd4AaABAg,,@xiunguyen7421,Đã quá Quỳnh ơi,2020-05-25T02:07:39Z,0
top,p8KWdCzUHZM,Ugyo7wSR3Qxa8AB6zD54AaABAg,,@hoangquoctrung2672,Ăn muốn chết luôn 🤣,2020-05-25T02:07:29Z,0
top,p8KWdCzUHZM,Ugy6PNSblkh-UFsyeSR4AaABAg,,@haofficial7342,Trời ơi 13tr bằng tài sản của nhà mình(dịch này đói meo,2020-05-25T02:07:25Z,1
top,p8KWdCzUHZM,UgwD5TeGqFRXlaI4r_B4AaABAg,,@duonghothithuy9916,Mẹ meeẹ cái này cái gìiii mẹ :&gt;,2020-05-25T02:06:59Z,0
top,p8KWdCzUHZM,UgwtawX4JJ1mBUHnOPh4AaABAg,,@ThuyNguyen-wn5qf,Ở Nhật đàn ô đứng bán ko hả Huỳnh.😂😂😂,2020-05-25T02:04:45Z,1
top,p8KWdCzUHZM,Ugy5Pz18hQOE-BrLIJJ4AaABAg,,@InJjing,"<b><a href=""https://www.youtube.com/watch?v=p8KWdCzUHZM&amp;t=1401"">23:21</a></b><b> Tiệc hải sản hôm nay!</b><br><b><a href=""https://www.youtube.com/watch?v=p8KWdCzUHZM&amp;t=1543"">25:43</a></b><b> Sẽ rất khó để chuẩn bị nhiều thực phẩm này.</b><br><b>Cô ấy thật tuyệt!</b><br><br><b>Tôi chúc mừng bạn với 3 triệu thuê bao.   - như một fan hâm mộ của cô -😊👍</b>",2020-05-25T02:04:17Z,645
reply,p8KWdCzUHZM,Ugy5Pz18hQOE-BrLIJJ4AaABAg.993USiMcd-x993z5QZbNmz,Ugy5Pz18hQOE-BrLIJJ4AaABAg,@LinhLus,ủa ... chị quỳnh liên quan gì đến  anh độ,2020-05-25T06:40:43Z,3
reply,p8KWdCzUHZM,Ugy5Pz18hQOE-BrLIJJ4AaABAg.993USiMcd-x994-yLf-BWi,Ugy5Pz18hQOE-BrLIJJ4AaABAg,@zennyhuynh6082,Ăn cua 10tr bà Quỳnh o nhà thuê kk,2020-05-25T06:57:06Z,2
reply,p8KWdCzUHZM,Ugy5Pz18hQOE-BrLIJJ4AaABAg.993USiMcd-x9941Sx7d9e7,Ugy5Pz18hQOE-BrLIJJ4AaABAg,@minhhuynh8794,Ngèo cmm,2020-05-25T07:10:09Z,2
reply,p8KWdCzUHZM,Ugy5Pz18hQOE-BrLIJJ4AaABAg.993USiMcd-x9942QmdmReK,Ugy5Pz18hQOE-BrLIJJ4AaABAg,@LinhLus,@zennyhuynh6082 ừ . nghèo thực sự 🤣🤣🤣 <br>1 bữa quay clip như này với số tiền đó cho mình ăn cả tháng không hết,2020-05-25T07:18:35Z,4
reply,p8KWdCzUHZM,Ugy5Pz18hQOE-BrLIJJ4AaABAg.993USiMcd-x99455P_oXgV,Ugy5Pz18hQOE-BrLIJJ4AaABAg,@ngocmaii624,@LinhLus ngta có nói gì liên quan tới anh độ đâu bạn ?,2020-05-25T07:41:53Z,2
top,p8KWdCzUHZM,UgzM64Vm_MOF4GyvZG14AaABAg,,@李秋木-t3u,Chuc di thanh cong,2020-05-25T02:04:01Z,0
top,p8KWdCzUHZM,UgyVeEiUuMTgvdVv9L14AaABAg,,@thaokim7716,bà ăn như dậy con mẹ và e bà ở vn đói lên đói xuống,2020-05-25T02:03:23Z,0
top,p8KWdCzUHZM,Ugzo4UXjVbaTQFWioxN4AaABAg,,@tranthuan9117,101  k,2020-05-25T02:01:14Z,0
top,p8KWdCzUHZM,UgxaBJ5WvX2Ve0l_iC14AaABAg,,@pelyhanquoc4187,Chảy nước miếng chi ơi,2020-05-25T02:00:42Z,0
top,p8KWdCzUHZM,UgzhKBo4S_7qG7l3Ryx4AaABAg,,@phuongvyvlog6127,Chúc mừng Chi đạt 3tr sub nha....,2020-05-25T02:00:27Z,0
top,p8KWdCzUHZM,UgwHchV3g0nOkrhsI-l4AaABAg,,@kimtu4242,HeLo,2020-05-25T02:00:15Z,0
top,p8KWdCzUHZM,UgzEbMZ4OQNfkib9d-V4AaABAg,,@thuongtrieu8852,"K bít ăn ngon k chớ nhìn là no con mắt rùi đó,..",2020-05-25T01:55:50Z,0
top,p8KWdCzUHZM,UgxNB42X3MC_HOgS_hZ4AaABAg,,@LamTruong-io7xq,Ngày mài đạt 4 triệu nà,2020-05-25T01:55:40Z,0
top,p8KWdCzUHZM,UgzyjAg1f-LYvXohfRR4AaABAg,,@yeuanime2828,30万　50万😹,2020-05-25T01:52:54Z,0
top,p8KWdCzUHZM,UgxvIXnpPqCxPpI69bJ4AaABAg,,@thanhthongthanh7330,Quá tuyệt ngon quá,2020-05-25T01:52:46Z,0
top,p8KWdCzUHZM,Ugy2oVLKerJ9n_8xcIx4AaABAg,,@hanhnhat9486,Chị ơi ngon lắm luôn đó chị,2020-05-25T01:52:10Z,0
top,p8KWdCzUHZM,Ugz9PWyMP6qCjJmDldN4AaABAg,,@hiepthinhle7873,E đê thương và chân thành mong như thế mãi e nha,2020-05-25T01:50:54Z,0
top,p8KWdCzUHZM,UgwsdT22S3xqFGZGo6x4AaABAg,,@gaique9549,Chúc kênh của chị ngày càng phát triển hơn và được thật nhiều nhìu người đăng ký. Thương gia đình của chị.,2020-05-25T01:50:49Z,0
top,p8KWdCzUHZM,UgwJ-yQOpPsZz4ASKfR4AaABAg,,@tranmchivlogs7358,"Mình rất thích xem những chia sẽ rất hay của Huỳnh Trần , mình cũng làm ẩm thực quê hôm nào rảnh rỗi ghé qua xem thử nha các bạn cám ơn rất là nhiều",2020-05-25T01:48:05Z,0
top,p8KWdCzUHZM,UgxXELQBdHQgiIHNvQh4AaABAg,,@votam111,Ở nhật có vui k chị,2020-05-25T01:46:35Z,0
top,p8KWdCzUHZM,Ugyx8IrCBAHk80mupm14AaABAg,,@nhungha7772,Hoanh trang qua,2020-05-25T01:45:59Z,0
top,p8KWdCzUHZM,UgxO3EOfUQHUBk9yJa94AaABAg,,@diepchitrinh9616,Hoành tráng qa chị quỳnh oi,2020-05-25T01:44:59Z,0
top,p8KWdCzUHZM,Ugzd3Lb2d6n1182l3ER4AaABAg,,@leha1557,Chúc mừng 2 mẹ con 💗,2020-05-25T01:44:51Z,4
top,p8KWdCzUHZM,UgwotoqVZR8vgJ9VWqh4AaABAg,,@VuTran-mx7in,Có người thì kh có ăn hay làm cả đời cx kh ăn đc dày vậy mà hồi lúc than youtube sao giảm lương thay vì đấy nghỉ ăn 1 bữa  làm 1 clip đi làm từ thiện????,2020-05-25T01:44:40Z,0
top,p8KWdCzUHZM,UgyiAEmvn791XBK2WVJ4AaABAg,,@Hao-xc3pv,chị làm clip về quê đi 🤗,2020-05-25T01:43:49Z,2
reply,p8KWdCzUHZM,UgyiAEmvn791XBK2WVJ4AaABAg.993S6nlPm3L993eRB0gFm2,UgyiAEmvn791XBK2WVJ4AaABAg,@sarakids4063,có rồi mà bạn.,2020-05-25T03:40:11Z,0
top,p8KWdCzUHZM,UgzApTH40fSb7g1Khcd4AaABAg,,@BinhNguyen-mr5db,chúc mừng cô quỳnh nha❤,2020-05-25T01:42:46Z,1
top,p8KWdCzUHZM,UgwlXOULPP3Krd-f40N4AaABAg,,@PhuongBui-nu9nv,Công nhận chị khéo tay thật. Món gì cũng biết làm,2020-05-25T01:40:22Z,0
top,p8KWdCzUHZM,UgwqhRxYUOUGLtgd0fl4AaABAg,,@anhai1004,Bữa này phải 10man hơn đấy,2020-05-25T01:40:09Z,0
top,p8KWdCzUHZM,UgzWfalgeMOF6FbTuut4AaABAg,,@LàmchơiănthiệtNQB,"Chúc mừng chị,  mỗi lần xem clip của chị thèm muốn chết luôn vậy đó",2020-05-25T01:36:48Z,0
top,p8KWdCzUHZM,Ugx0dCQVMgSlVWp8NA54AaABAg,,@PhuongNguyen-vd2sy,Nhìn mâm đồ ăn e làm nhìn hấp dẫn quá Quỳnh ơi. Nhìn thấy thèm quá chừng.,2020-05-25T01:36:07Z,0
top,p8KWdCzUHZM,UgzLcjbiEdUQHIWcV8t4AaABAg,,@linhthao3327,mọi ng hãy nhìn vào mặt của bé Sa,2020-05-25T01:35:10Z,0
top,p8KWdCzUHZM,UgzvZtpC0iOsyOIqIHx4AaABAg,,@duyenhai8saigon53,SAO K THẤY CHỊ ĂN ỐC VÒI VOI TA,2020-05-25T01:33:32Z,0
top,p8KWdCzUHZM,UgySpBkaheRmQbZDskR4AaABAg,,@quyento3495,Đoạn Tiếng Nhật Chị Vietsub Cho Tụi E Nghe Với Chị Ơi..,2020-05-25T01:31:55Z,1
top,p8KWdCzUHZM,Ugz584typ0NYOYkqe194AaABAg,,@sushifamily3131,Chất quá chị quỳnh ơi.👍🏻,2020-05-25T01:30:05Z,1
top,p8KWdCzUHZM,UgxCoY8nGapQOaTguCx4AaABAg,,@ongngoaivlog2008,Sa dễ thương quá chi Quỳnh nấu bánh canh cua di chi,2020-05-25T01:28:43Z,0
top,p8KWdCzUHZM,UgwLupCTshNSeiiJBGt4AaABAg,,@HanhNguyen-kx4ye,Hoành tráng quá chị ơi. Chúc mừng chị đạt 3m sub,2020-05-25T01:27:34Z,0
top,p8KWdCzUHZM,UgzfGG41CziInbfxydJ4AaABAg,,@huyenphan2592,Chợ hải sản ở Nhật toàn đàn ông nhỉ :)))),2020-05-25T01:22:48Z,15
reply,p8KWdCzUHZM,UgzfGG41CziInbfxydJ4AaABAg.993PhstrXtz993kJUht_AY,UgzfGG41CziInbfxydJ4AaABAg,@PhuongPhan-uj1wr,90% là đàn ông buôn bán ở chợ nhật đó b,2020-05-25T04:31:34Z,0
top,p8KWdCzUHZM,Ugw3R9cyNpqRk6aUIyR4AaABAg,,@nguyenvanquynh9746,Nhìn bà ăn mà thèm quá,2020-05-25T01:20:16Z,0
top,p8KWdCzUHZM,UgxTSUJ0aFu6VhCJBKh4AaABAg,,@jessicanguyen7425,"Nhìn mồm nhỏ này ăn sao tui thấy sợ thế hả trời, cảm giác như nó nuốt được cả con cua luôn ấy 😩. Con gái con đứa ăn nhai đầy mồm, Phùng mang trợn mắt lên nhìn thấy gớm!",2020-05-25T01:19:57Z,0
top,p8KWdCzUHZM,Ugyj7xGTfBuKTe94Rhd4AaABAg,,@aicatit2100,Cj Quỳnh giỏi tiếng nhật ghê á,2020-05-25T01:18:17Z,0
top,p8KWdCzUHZM,UgwbkqVaK0BYh2eq8E94AaABAg,,@canhvinguyen6457,chuc mung chi dat 3 trieu va sa nhieu nua! Em cung thich su dung san pham DH Foods!,2020-05-25T01:18:01Z,0
top,p8KWdCzUHZM,UgwNaQrp9pOwkLqtT1F4AaABAg,,@bepcodiem8372,Sao em theo dõi kênh chi ma ko thấy câu hỏi chi vay,2020-05-25T01:15:17Z,0
top,p8KWdCzUHZM,UgyXagMQvrID1Tzecxh4AaABAg,,@xuanthao7031,"Bữa ăn xịn quá chị ơi &lt;3 theo chị cũng được kha khá lâu rồi, thích Sa với chị Quỳnh lắmmmm, chúc chị có thêm nhiều lượt sub, chị ăn quá trời mà còn ốm hơn e giảm cân tối ngày nữa T.T",2020-05-25T01:14:57Z,2
top,p8KWdCzUHZM,UgzWIOsD2ZRppfyg-E14AaABAg,,@pimpham6408,Nhìn cái chân cua lúc chị bẻ sợ trúng thằng Sa ghê,2020-05-25T01:13:23Z,0
top,p8KWdCzUHZM,UgxR0FZU2EcFmd5Rbs14AaABAg,,@quoctranvloc8579,Huỳnh có ox tuyệt vời .. chúc gd sức khỏe nha,2020-05-25T01:11:45Z,0
top,p8KWdCzUHZM,UgzTfbnAxXVfI3_a1LN4AaABAg,,@sonha2856,Ăn hết đóng này xĩu luôn,2020-05-25T01:11:40Z,0
top,p8KWdCzUHZM,UgwKRVcF_o86tCS2Khh4AaABAg,,@nhungvuthi2029,Môi bé sao đó chị,2020-05-25T01:09:06Z,0
top,p8KWdCzUHZM,UgwBOx06oXYAYhZXU2B4AaABAg,,@btsforever261,Cô quỳnh đỉnh quá 💥💥,2020-05-25T01:05:24Z,0
top,p8KWdCzUHZM,Ugz2uoBRrzV-7EZvBTN4AaABAg,,@ngocnganphan47,Chuc mung chi nha mong xom duoc4tr,2020-05-25T00:58:32Z,0
top,p8KWdCzUHZM,Ugza136OE05puUtxGlZ4AaABAg,,@tommyquyen,Bên đấy mua hàng có phải mặc cả kk chị,2020-05-25T00:58:04Z,0
top,p8KWdCzUHZM,Ugy-e8RsogMBXNG0dGl4AaABAg,,@hoanglannguyen6082,mâm hải sản này mình ăn 1 tháng mới hết,2020-05-25T00:57:53Z,0
top,p8KWdCzUHZM,Ugy4ojhkaufYOJD1hhB4AaABAg,,@minhhoa8343,Chúc mừng chị &lt;3&lt;3&lt;3,2020-05-25T00:57:25Z,2
top,p8KWdCzUHZM,Ugy9Xh_FPrD6JEee2RB4AaABAg,,@lamsung9121,Chong Quynh de thuiog ghe,2020-05-25T00:57:12Z,0
top,p8KWdCzUHZM,UgwfbfSpQY9lpo0QFB54AaABAg,,@nhuquynh8825,"Thôi chảy nước miếng rồi, ngon quá thèm quá, hu hu",2020-05-25T00:56:19Z,0
top,p8KWdCzUHZM,UgzT6JlTLtw0xINh2l94AaABAg,,@oanhhoang8124,Chúc mừng chi quỳnh của e. Hóng nút kim cương của chi,2020-05-25T00:55:12Z,6
top,p8KWdCzUHZM,Ugxig9nQben7t3-OKNZ4AaABAg,,@dungle2659,bh moi co duyen lam ytb nhu chi nhi,2020-05-25T00:53:41Z,1
top,p8KWdCzUHZM,Ugy-PJrq1c7cZ98CCiF4AaABAg,,@Nguyendao1708,"Phở bò sài gòn đi chị ơi, yêu chị",2020-05-25T00:53:29Z,0
top,p8KWdCzUHZM,Ugxo5Vx2JQDCiQwFOeZ4AaABAg,,@nguyenngochan6586,chúc mừng chị nhé 🥰🥰🥰🥰,2020-05-25T00:53:29Z,0
top,p8KWdCzUHZM,UgzEPmx-Q-3niXr29LF4AaABAg,,@luontichcuc,Thật sự video của cô Quỳnh rất chất lượng lun ý ạk😊😊🥰🥰🥰,2020-05-25T00:52:45Z,3
top,p8KWdCzUHZM,Ugyst4GK7oVjClqU5954AaABAg,,@nguyensansan824,Thèm quá cị ơi,2020-05-25T00:49:01Z,0
top,p8KWdCzUHZM,UgyHGVZOFggwH8EIAgN4AaABAg,,@OanhLe-og8vc,Xem mà chảy nước miếng rồi bà Quỳnh ơi,2020-05-25T00:44:42Z,0
top,p8KWdCzUHZM,UgwBGDS1iQDQR98bsbR4AaABAg,,@pmeans_137,"Sáng sớm coi, thèm gần chớt :v",2020-05-25T00:42:35Z,17
reply,p8KWdCzUHZM,UgwBGDS1iQDQR98bsbR4AaABAg.993L6GE7sCz993nwvQivWD,UgwBGDS1iQDQR98bsbR4AaABAg,@mexcuong6608,Hello bn,2020-05-25T05:03:18Z,0
top,p8KWdCzUHZM,UgzI5TcGlKBlgYDqxzJ4AaABAg,,@GIANGHUYENStudio,Cua gì mà to thế,2020-05-25T00:40:58Z,0
top,p8KWdCzUHZM,Ugwh9iDeLW1b59PLcQd4AaABAg,,@nhungliti2475,Ôi bé Sa 🤪🤪🤪🤪🤪🤩🤩🤩🤩!!!!,2020-05-25T00:38:13Z,0
top,p8KWdCzUHZM,UgwmRBR3Ei3mtnLEuCh4AaABAg,,@congthanh6799,💞💕💕💖💕💞💞💕💕💙💗💗❤💗❤💗❤💗❤💗❤💗❤💗❤💗,2020-05-25T00:35:03Z,0
top,p8KWdCzUHZM,UgyEIzU9lRC3gWA03mh4AaABAg,,@nhungvlog8839,Mãi ủng hộ Chị quỳnh và bé Sa,2020-05-25T00:33:39Z,0
top,p8KWdCzUHZM,UgxY_7NWxnjOm2s0YdZ4AaABAg,,@phuongnhinguyen6139,Sò diệp bên em nơ nhỏ bàn ngo cái à,2020-05-25T00:33:32Z,0
top,p8KWdCzUHZM,UgzLLi6d7mihBdfc38h4AaABAg,,@quegocong3065,10 người nhậu bàn này đã luôn,2020-05-25T00:33:19Z,0
